id,Full name,Email,Profile url,First name,Last name,Title,Avatar,Location,Address,Birthday,Summary,Twitter,Phone 1,Phone 1 type,Phone 2,Phone 2 type,Phone 3,Phone 3 type,Messenger 1,Messenger 1 type,Messenger 2,Messenger 2 type,Messenger 3,Messenger 3 type,Website 1,Website 2,Website 3,Organization 1,Organization Title 1,Organization Start 1,Organization End 1,Organization Description 1,Organization Location 1,Organization LI URL 1,Organization LI ID 1,Organization WWW 1,Organization Domain 1,Organization 2,Organization Title 2,Organization Start 2,Organization End 2,Organization Description 2,Organization Location 2,Organization LI URL 2,Organization LI ID 2,Organization WWW 2,Organization Domain 2,Organization 3,Organization Title 3,Organization Start 3,Organization End 3,Organization Description 3,Organization Location 3,Organization LI URL 3,Organization LI ID 3,Organization WWW 3,Organization Domain 3,Organization 4,Organization Title 4,Organization Start 4,Organization End 4,Organization Description 4,Organization Location 4,Organization LI URL 4,Organization LI ID 4,Organization WWW 4,Organization Domain 4,Organization 5,Organization Title 5,Organization Start 5,Organization End 5,Organization Description 5,Organization Location 5,Organization LI URL 5,Organization LI ID 5,Organization WWW 5,Organization Domain 5,Organization 6,Organization Title 6,Organization Start 6,Organization End 6,Organization Description 6,Organization Location 6,Organization LI URL 6,Organization LI ID 6,Organization WWW 6,Organization Domain 6,Organization 7,Organization Title 7,Organization Start 7,Organization End 7,Organization Description 7,Organization Location 7,Organization LI URL 7,Organization LI ID 7,Organization WWW 7,Organization Domain 7,Education 1,Education Degree 1,Education FOS 1,Education Grade 1,Education Start 1,Education End 1,Education Description 1,Education 2,Education Degree 2,Education FOS 2,Education Grade 2,Education Start 2,Education End 2,Education Description 2,Education 3,Education Degree 3,Education FOS 3,Education Grade 3,Education Start 3,Education End 3,Education Description 3,Skills,Followers,Relationship,Connected at,Industry,Mutual Count,Mutual,Mutual 1,Mutual 2,Interests
dr-tapas-panigrahi-8990882,Tapas Panigrahi,,https://www.linkedin.com/in/dr-tapas-panigrahi-8990882/,Tapas,Panigrahi,"Assistant Professor at International Institute of Information Technology, Bhubaneswar University, Odisha",https://media-exp1.licdn.com/dms/image/C5603AQGuNborvm5YYg/profile-displayphoto-shrink_200_200/0?e=1592438400&v=beta&t=keYJXVDurallv6XvEXlePetepasxAKFqJlvZprxqqu8,"Bhubaneshwar Area, India",,,,,,,,,,,,,,,,,,,,INTERNATIONAL INSTITUTE OF INFORMATION TECHNOLOGY BHUBANESWAR UNIVERSITY,ASST. PROFESSOR,Aug-10,PRESENT,Teaching & Research,BHUBANESWAR ORISSA INDIA,https://www.linkedin.com/company/iiit-bhubaneswar,iiit-bhubaneswar,,,CEB,ASSOCIATE PROFESSOR,2007,2010,"Teaching, Research, Head of EEE Dept",,https://www.linkedin.com/search/results/all/?keywords=CEB,,,,"ORISSA ENGG COLLEGE, BHUBANESWAR",ASST PROFESSOR,Aug-95,Aug-07,"Teaching, Research",,https://www.linkedin.com/search/results/all/?keywords=ORISSA%20ENGG%20COLLEGE%2C%20BHUBANESWAR,,,,,,,,,,,,,,,,,,,,,,,,,,,,,,,,,,,,,,,,,,,,Sambalpur University,Doctor of Philosophy (Ph.D.),Electrical Engineering,,2010,2014,,PURI ZILLA SCHOOL PURI,10TH,,,1978,1986,,,,,,,,,"""Teaching : 4, Research : 3, Matlab : 2, Science : 1, Higher Education : 1, Electrical Engineering : 1, Statistics : 0, C : 1, Public Speaking : 0, Distributed Generation : 0, Electrical Machines : 0, """,,3,,Research,,,,,IIIT Bhubaneswar; Controlled Environments Magazine; Jadavpur University; Sambalpur University
subhasmita-nayak-76990a180,Subhasmita Nayak,,https://www.linkedin.com/in/subhasmita-nayak-76990a180/,Subhasmita,Nayak,"Bachelor's degree at International Institute of Information Technology, Bhubaneswar",https://media-exp1.licdn.com/dms/image/C5103AQH4Yzr-H8V_Tg/profile-displayphoto-shrink_200_200/0?e=1592438400&v=beta&t=NcQ2pryaBxPV6V6WaEyY8aJzIeUrQh4npoITfBWgxzk,India,,,"Having a great experience as Data Analyst with a very good and supportive work evironment with many different kinda peoples all over india .   This  is a great combinations with work and culture of different religions,different languages,different foods is a very great experience.",,,,,,,,,,,,,,,,,Flipkart,Data Analyst,Nov-16,PRESENT,"Maintaining the work automation using MS Excel, SQL Query & Data analysis. ? Data Extraction ,Transformation & reporting Using SQL , Excel & Tableau.  ? Designing dashboards and Involved in transition of reporting using Tableau. ? Designed databases, reports, and data input interfaces using SQL Server 2008 ? Working in designing and developing relational databases. ? Ability to understand the client's requirement, and deliver the same in an effective manner. ? Creating unique product id for every product using personal tool called ?Flipkart seller hub?. ? As per our client requirement I am updating that product details to particular seller. ? Update the data of product in SQL server by writing sql queries. ? Creating daily, monthly and weekly reports at seller and category level by writing queries using SQL server and personal tools. ? Data Extraction from source data manipulation & reporting. ? Generating Pivot tables for data summary. see less",Bangalore,https://www.linkedin.com/company/flipkart,flipkart,,,,,,,,,,,,,,,,,,,,,,,,,,,,,,,,,,,,,,,,,,,,,,,,,,,,,,,,,,,,,,,"International Institute of Information Technology, Bhubaneswar",Bachelor's degree,Information Technology,,2011,2015,Participating in cultural activity like dance and crafting also designing cloths .,,,,,,,,,,,,,,,"""Tableau : 1, Microsoft Power Query : 0, Macro : 0, Data Visualization : 0, Looker (Software) : 0, R : 0, Unix : 0, SQL : 0, SQL Server Reporting Services (SSRS) : 0, SQL Server Integration Services (SSIS) : 0, sql : 0, ggplot : 0, Data Analytics : 0, data frame : 0, """,,3,,Computer Software,,,,,American Express; Wipro Limited; Satya Nadella; Amazon; Bill Gates; IBM
stuti-chakraborty-17aa33a8,Stuti Chakraborty,,https://www.linkedin.com/in/stuti-chakraborty-17aa33a8/,Stuti,Chakraborty,"Graduate Teaching Assistant at International Institute of Information Technology, Bhubaneswar","data:image/gif;base64,R0lGODlhAQABAIAAAAAAAP///yH5BAEAAAAALAAAAAABAAEAAAIBRAA7",India,,,,,,,,,,,,,,,,,,,,"International Institute of Information Technology, Bhubaneswar",Graduate Teaching Assistant,Jul-17,PRESENT,,"Bhubaneshwar Area, India",https://www.linkedin.com/search/results/all/?keywords=International%20Institute%20of%20Information%20Technology%2C%20Bhubaneswar,,,,,,,,,,,,,,,,,,,,,,,,,,,,,,,,,,,,,,,,,,,,,,,,,,,,,,,,,,,,,,,,"International Institute of Information Technology, Bhubaneswar",M.Tech,Power System,,2017,2019,,"Bhilai Institute of Technology (BIT), Durg",Engineer?s Degree,ELECTRICAL,A,2012,2016,"A throughout distinction holder,completed bachelors with honours and 9.2 cgpahave patience, perseverance , dedication and sincere",,,,,,,,"""Microsoft Office : 1, Customer Service : 1, Management : 1, Research : 1, Project Management : 1, Microsoft Excel : 1, Microsoft Word : 1, PowerPoint : 1, Leadership : 1, Public Speaking : 1, """,,3,,Higher Education,,,,,"Bhilai Institute of Technology (BIT), Durg; International Institute of Information Technology, Bhubaneswar"
sandeep2010bbsr,Sandeep Kumar Patro,,https://www.linkedin.com/in/sandeep2010bbsr/,Sandeep,Patro,"Student at International Institute of Information Technology, Bhubaneswar","data:image/gif;base64,R0lGODlhAQABAIAAAAAAAP///yH5BAEAAAAALAAAAAABAAEAAAIBRAA7","Khorda, Orissa, India",,,,,,,,,,,,,,,,,,,,,,,,,,,,,,,,,,,,,,,,,,,,,,,,,,,,,,,,,,,,,,,,,,,,,,,,,,,,,,,,,,,,,,,,,,"International Institute of Information Technology, Bhubaneswar",,Electronics and Telecommunication,,2012,2016,,,,,,,,,,,,,,,,"""Microsoft Office : 1, Customer Service : 0, Management : 0, Research : 0, Project Management : 0, Microsoft Excel : 0, Microsoft Word : 0, PowerPoint : 0, Leadership : 0, Public Speaking : 0, """,,3,,Telecommunications,,,,,"International Institute of Information Technology, Bhubaneswar"
bijaylaxmi23,Bijay L.,,https://www.linkedin.com/in/bijaylaxmi23/,Bijay,L.,"Junior Academic Administrator at International Institute of Information Technology, Bhubaneswar",https://media-exp1.licdn.com/dms/image/C5103AQHAr9dMO-88Vw/profile-displayphoto-shrink_200_200/0?e=1592438400&v=beta&t=bbbCPI0RI5ddGGzBTe5VI93fFfr3v4n7KR2aTrbROn8,"Khorda, Orissa, India",,Aug-23,"Former Master Trainer Soft Skills, Currently into assisting  Academic and Exam  Administration, Admission#ONO ?Team player ?Leadership skills ?Quick learner ?A good listener ?Counselling Students ?Self motivated ?Empath",,,,,,,,,,,,,,,,,"International Institute of Information Technology, Bhubaneswar",Junior Academic Administrator,Mar-19,PRESENT,,"Bhubaneshwar Area, India",https://www.linkedin.com/company/international-institute-of-information-technology-bhubaneswar,international-institute-of-information-technology-bhubaneswar,,,CL Educate Ltd.,Soft Skills Trainer,Dec-17,Feb-19,"Soft Skills Training, Personality Development,Communication training,Resume making, Preparing for Job interviews, Counselling students, Co-ordinating in Mobilisation,Activity Based teaching, Making reports",,https://www.linkedin.com/company/cl-educate-ltd-,cl-educate-ltd-,,,,,,,,,,,,,,,,,,,,,,,,,,,,,,,,,,,,,,,,,,,,,,,,,,,,,Symbiosis Centre for Distance Learning,Single Course,"Human Resources Management/Personnel Administration, General",A,2019,2020,,Rama Devi Women's University,Certificate Course,French,,2019,2020,,"Biju Patnaik University of Technology, Odisha",Master of Business Administration - MBA,Finance,,,PRESENT,,"""Academic Administration : 1, Office Administration : 0, Personality Development : 0, Documentation : 0, Data Analysis : 0, Report Writing : 0, content writing : 0, Microsoft Word : 0, Microsoft PowerPoint : 0, Training : 0, Soft Skills : 0, Teaching English as a Second Language : 0, Career Counseling : 0, Coaching : 0, Organizational Development : 0, Communication : 0, Management : 0, Leadership : 0, Training & Development : 0, Admissions Counseling : 0, Tele calling : 0, Body Language : 0, Classroom Assessment : 0, Feedback Management : 0, """,249,3,,Higher Education,,,,,Free Udemy Courses (Variant Fields of Knowledge); Intel Corporation; GE; Deloitte; Bill Gates; PwC
preetam-behera-a56b4a111,Preetam Behera,,https://www.linkedin.com/in/preetam-behera-a56b4a111/,Preetam,Behera,"Student at International Institute of Information Technology, Bhubaneswar","data:image/gif;base64,R0lGODlhAQABAIAAAAAAAP///yH5BAEAAAAALAAAAAABAAEAAAIBRAA7","Khorda, Orissa, India",,,,,,,,,,,,,,,,,,,,,,,,,,,,,,,,,,,,,,,,,,,,,,,,,,,,,,,,,,,,,,,,,,,,,,,,,,,,,,,,,,,,,,,,,,"International Institute of Information Technology, Bhubaneswar",Bachelor's degree,Computer Science And Engineering,,2015,2019,,,,,,,,,,,,,,,,"""""",,3,,Computer & Network Security,,,,,Daniel Goleman; Harvard Business Review; Massachusetts Institute of Technology; Forbes; Arianna Huffington; BBC
dibyajyoti-mishra-9049a989,Dibyajyoti Mishra,,https://www.linkedin.com/in/dibyajyoti-mishra-9049a989/,Dibyajyoti,Mishra,Student at International Institute of Information Technology Bhubaneswar,https://media-exp1.licdn.com/dms/image/C4E03AQGaFsMT5mnFPA/profile-displayphoto-shrink_200_200/0?e=1592438400&v=beta&t=59G1IoV2ZqSC-Ve_87TZIVReCbt5Wv5NuxDVAE24KGY,"Khorda, Orissa, India",,,,,,,,,,,,,,,,,,,,,,,,,,,,,,,,,,,,,,,,,,,,,,,,,,,,,,,,,,,,,,,,,,,,,,,,,,,,,,,,,,,,,,,,,,International Institute of Information Technology Bhubaneswar,Bachelor's degree,Information Technology,,2012,2016,,College of Basic Science anf humanities OUAT,,,,2009,2011,,,,,,,,,"""""",,3,,Information Technology & Services,,,,,
manaswinee-behera-b59286124,Manaswinee Behera,,https://www.linkedin.com/in/manaswinee-behera-b59286124/,Manaswinee,Behera,"Student at International Institute of Information Technology, Bhubaneswar","data:image/gif;base64,R0lGODlhAQABAIAAAAAAAP///yH5BAEAAAAALAAAAAABAAEAAAIBRAA7","Bhubaneshwar Area, India",,,TCS QA SAP MM,,,,,,,,,,,,,,,,,Tata Consultancy Services,Assistant System Engineer,Mar-18,PRESENT,,"Bhubaneshwar Area, India",https://www.linkedin.com/company/tata-consultancy-services,tata-consultancy-services,,,,,,,,,,,,,,,,,,,,,,,,,,,,,,,,,,,,,,,,,,,,,,,,,,,,,,,,,,,,,,,"International Institute of Information Technology, Bhubaneswar",,,,2013,2017,,,,,,,,,,,,,,,,"""Microsoft Office : 0, Microsoft Excel : 0, Microsoft Word : 0, Quality Assurance : 0, Microsoft PowerPoint : 0, SAP Materials Management (SAP MM) : 0, Public Speaking : 0, """,,3,,Information Technology & Services,,,,,Computerworld; IBM; TED Conferences; CNET; Jack Welch; EY
shiba-paital-b00871111,Shiba Paital,,https://www.linkedin.com/in/shiba-paital-b00871111/,Shiba,Paital,"Research Scholar (Ph.D.)  International Institute of Information Technology, Bhubaneswar","data:image/gif;base64,R0lGODlhAQABAIAAAAAAAP///yH5BAEAAAAALAAAAAABAAEAAAIBRAA7","Khorda, Orissa, India",,,,,,,,,,,,,,,,,,,,"Radhakrishna Institute of Engineering and Technology (RITE), Khurda, Bhubaneswar",Assistant Professor,Jun-13,Jul-15,,"Khurda, Bhubaneswar",https://www.linkedin.com/company/radhakrishna-institute-of-engineering-and-technology-rite-khurda-bhubaneswar,radhakrishna-institute-of-engineering-and-technology-rite-khurda-bhubaneswar,,,,,,,,,,,,,,,,,,,,,,,,,,,,,,,,,,,,,,,,,,,,,,,,,,,,,,,,,,,,,,,"International Institute of Information Technology, Bhubaneswar",,,,2015,2019,,,,,,,,,,,,,,,,"""""",,3,,Education Management,,,,,"International Institute of Information Technology, Bhubaneswar"
nikita-raj-965473155,Nikita Raj,,https://www.linkedin.com/in/nikita-raj-965473155/,Nikita,Raj,Application Developer at IBM,https://media-exp1.licdn.com/dms/image/C5103AQH6HPc6kcc-_w/profile-displayphoto-shrink_200_200/0?e=1592438400&v=beta&t=J_hRv6WdLtbZ9W6VCqHia9tqJWixZjbYaNZmLB3qkrY,"Angul, Orissa, India",,,"YES , ?Brevity is good?. So here?s quick thing about me and my work.  I am a Graduate from International Institute of Information technology, Bhubaneswar with specialization in Electronics and telecommunication.  Have nearly 2 years of experience working as an application developer in Mainframe technology with a decent knowledge of COBOL, PLI, IBM DB2 , MYSQL . I am equally conformable with C, JAVA and MATLAB software. My hobbies are playing sports , dancing and doing physical stuff. I believe the only way to do great work is to love what you do and if you don?t like your work then the best is yet to come.",,,,,,,,,,,,,,,,,IBM,Application Developer,Aug-18,PRESENT,,"Bengaluru, Karnataka",https://www.linkedin.com/company/ibm,ibm,,,,,,,,,,,,,,,,,,,,,,,,,,,,,,,,,,,,,,,,,,,,,,,,,,,,,,,,,,,,,,,"International Institute of Information Technology, Bhubaneswar",Bachelor of Technology - BTech,"Electrical, Electronics and Communications Engineering",,2014,2018,,,,,,,,,,,,,,,,"""Programming : 0, C (Programming Language) : 0, RDBMS : 0, Algorithms : 0, Database Management System (DBMS) : 0, """,,3,,Information Technology & Services,,,,,"Amazon Web Services (AWS); IBM; International Institute of Information Technology, Bhubaneswar"
jayant-kumar-44a76085,Jayant Kumar,,https://www.linkedin.com/in/jayant-kumar-44a76085/,Jayant,Kumar,"Student at international institute of information technology,bhubaneswar",https://media-exp1.licdn.com/dms/image/C4E03AQFxwGqBhD4m_g/profile-displayphoto-shrink_200_200/0?e=1592438400&v=beta&t=uDS7EB5Heco14A24JmysN7AVtQGPzh4ZTS6e90pV0lI,"Khorda, Orissa, India",,,,,,,,,,,,,,,,,,,,,,,,,,,,,,,,,,,,,,,,,,,,,,,,,,,,,,,,,,,,,,,,,,,,,,,,,,,,,,,,,,,,,,,,,,"international institute of information technology,bhubaneswar",,,,2013,2017,,,,,,,,,,,,,,,,"""""",,3,,Information Technology & Services,,,,,
rathin-chandra-a66947132,Rathin Chandra,,https://www.linkedin.com/in/rathin-chandra-a66947132/,Rathin,Chandra,"Ph.D. Reseach Scholar at International Institute of Information Technology, Bhubaneswar",https://media-exp1.licdn.com/dms/image/C4E03AQHpyP5uO9vMIg/profile-displayphoto-shrink_200_200/0?e=1592438400&v=beta&t=9lO91JUyF4Oog6uV8AjLIlQ18b2O4jn3sSMBOiB4aVo,,,,,,,,,,,,,,,,,,,,,"International Institute of Information Technology, Bhubaneswar",Ph.D. Reseach Scholar,Aug-16,PRESENT,,,https://www.linkedin.com/company/international-institute-of-information-technology-bhubaneswar,international-institute-of-information-technology-bhubaneswar,,,,,,,,,,,,,,,,,,,,,,,,,,,,,,,,,,,,,,,,,,,,,,,,,,,,,,,,,,,,,,,"Veer Surendra Sai University Of Technology ( Formerly UCE ), Burla",Master of Technology - MTech,,,,PRESENT,,,,,,,,,,,,,,,,"""""",,3,,Higher Education,,,,,
lalit-biswal-a4389458,Lalit Biswal,,https://www.linkedin.com/in/lalit-biswal-a4389458/,Lalit,Biswal,"Student at INTERNATIONAL INSTITUTE OF INFORMATION TECHNOLOGY,BHUBANESWAR",https://media-exp1.licdn.com/dms/image/C5103AQEgpqj3zV24WA/profile-displayphoto-shrink_200_200/0?e=1592438400&v=beta&t=AA6OjYkdM6dWdkG0-PTFnpO5uk05B1f1PVLwKn2VUf0,"Khorda, Orissa, India",,,,,,,,,,,,,,,,,,,,,,,,,,,,,,,,,,,,,,,,,,,,,,,,,,,,,,,,,,,,,,,,,,,,,,,,,,,,,,,,,,,,,,,,,,"INTERNATIONAL INSTITUTE OF INFORMATION TECHNOLOGY,BHUBANESWAR",Bachelor's degree,Information Technology,,2009,2013,,,,,,,,,,,,,,,,"""""",,3,,Computer Software,,,,,Capgemini Global Alumni
sushant-sadangi-21a627100,Sushant Sadangi,,https://www.linkedin.com/in/sushant-sadangi-21a627100/,Sushant,Sadangi,"Student at International Institute of Information Technology , Bhubaneswar","data:image/gif;base64,R0lGODlhAQABAIAAAAAAAP///yH5BAEAAAAALAAAAAABAAEAAAIBRAA7","Khorda, Orissa, India",,,,,,,,,,,,,,,,,,,,,,,,,,,,,,,,,,,,,,,,,,,,,,,,,,,,,,,,,,,,,,,,,,,,,,,,,,,,,,,,,,,,,,,,,,"International Institute of Information Technology , Bhubaneswar",,,,2013,2017,,,,,,,,,,,,,,,,"""""",,3,,Computer Software,,,,,ASC Information Technology; TARQ-PCI; Command Information; Helsinki Institute for Information Technology; International Institute of St. Louis; JMA Information Technology
abhineel-nandi-0004,Abhineel Nandi,,https://www.linkedin.com/in/abhineel-nandi-0004/,Abhineel,Nandi,"Student at International Institute of Information Technology, Bhubaneswar",https://media-exp1.licdn.com/dms/image/C5603AQFL9Vry-3t0xw/profile-displayphoto-shrink_200_200/0?e=1592438400&v=beta&t=cQ2ooKIsX34IaedSXH9h3K2c6r4rJPaq0JcqDHXQlBI,"Cuttack, Orissa, India",,,,,,,,,,,,,,,,,,,,,,,,,,,,,,,,,,,,,,,,,,,,,,,,,,,,,,,,,,,,,,,,,,,,,,,,,,,,,,,,,,,,,,,,,,"International Institute of Information Technology, Bhubaneswar",Bachelor of Technology - BTech INFORMATION TECHNOLOGY,"Code Optimization,Learning newer programming languages and DATA BASE MANAGEMENT and NETWORK SECURITY",,2019,2023,"I have always wanted to make out space for everything and hence found no better place than my code to implement.I am an avid communicator, orator and a geek for Data management and Network Security.I have won competitions on pitching start up ideas related to technology and innovations.",Navy Children School,,,,,PRESENT,,,,,,,,,"""C (Programming Language) : 0, Python (Programming Language) : 0, Competitive Programming : 0, Strategic Communications : 0, Deep Learning : 0, JAVA : 0, HTML5 : 0, CSS3 : 0, JavaScript : 0, Database Management System (DBMS) : 0, Optimization Algorithms : 0, Brainstorming : 0, """,,3,,Computer Software,,,,,"International Institute of Information Technology, Bhubaneswar; Indian Institute of Technology, Bombay; Satya Nadella; Microsoft; upGrad; Google"
abhishek-dwivedi-069104115,Abhishek Dwivedi,,https://www.linkedin.com/in/abhishek-dwivedi-069104115/,Abhishek,Dwivedi,"Student at International Institute of Information Technology, Bhubaneswar",https://media-exp1.licdn.com/dms/image/C5103AQGnbIjjgYd2dQ/profile-displayphoto-shrink_200_200/0?e=1592438400&v=beta&t=dtW5dDjHBiQauoNS2x4xbUTMaWvshSD1KF5lgdzFM0w,"Khorda, Orissa, India",,,,,,,,,,,,,,,,,,,,Infosys,Systems Engineer,Jun-18,PRESENT,,Hyderabad,https://www.linkedin.com/company/infosys,infosys,,,,,,,,,,,,,,,,,,,,,,,,,,,,,,,,,,,,,,,,,,,,,,,,,,,,,,,,,,,,,,,"International Institute of Information Technology, Bhubaneswar",,,,2014,2018,,"Mother's Public School, Bhubaneswar",12th CBSE,Science,,2012,2014,,"Loyola School, Bhubaneswar",10th ICSE,,,2003,2012,,"""SAP Materials Management (SAP MM) : 0, SAP ERP : 0, Python (Programming Language) : 0, Machine Learning : 0, Unreal Engine 4 : 0, """,,3,,,,,,,"Adam Bryant; Jake Nickell; International Institute of Information Technology, Bhubaneswar; Loic Le Meur; Obsidian Entertainment; Don Peppers"
adhisikha-patnaik-412208192,Adhisikha Patnaik,,https://www.linkedin.com/in/adhisikha-patnaik-412208192/,Adhisikha,Patnaik,"Student at International Institute of Information Technology, Bhubaneswar",https://media-exp1.licdn.com/dms/image/C5103AQED8cH1HITaAg/profile-displayphoto-shrink_200_200/0?e=1592438400&v=beta&t=4-ibxru9lAFz28HqBt0z41PL-Nt-r-5Zi11p7MdrIGo,"Ganjam, Orissa, India",,,,,,,,,,,,,,,,,,,,,,,,,,,,,,,,,,,,,,,,,,,,,,,,,,,,,,,,,,,,,,,,,,,,,,,,,,,,,,,,,,,,,,,,,,"International Institute of Information Technology, Bhubaneswar",B.Tech,Computer Science and Engineering,,2019,2023,,"De Paul School, Berhampur",12th,Science(ISC),96?,2016,2018,,"De Paul School,Berhampur","10th,ICSE",,97%,2015,2016,,"""Java : 0, """,,3,,Computer Software,,,,,"International Institute of Information Technology, Bhubaneswar"
bishwajit-dash-898858142,Bishwajit Dash,,https://www.linkedin.com/in/bishwajit-dash-898858142/,Bishwajit,Dash,"Student at International Institute of Information Technology, Bhubaneswar",https://media-exp1.licdn.com/dms/image/C4E03AQGT2FuUBVpxvg/profile-displayphoto-shrink_200_200/0?e=1592438400&v=beta&t=nhOckpb9zeucGTeTu-fm7FwVtNUmxLP5hPw12mOWZPI,"Khorda, Orissa, India",,,,,,,,,,,,,,,,,,,,,,,,,,,,,,,,,,,,,,,,,,,,,,,,,,,,,,,,,,,,,,,,,,,,,,,,,,,,,,,,,,,,,,,,,,"International Institute of Information Technology, Bhubaneswar",Bachelor of Technology,EEE,,2015,2019,,,,,,,,,,,,,,,,"""""",,3,,Electrical & Electronic Manufacturing,,,,,"Bill Gates; International Institute of Information Technology, Bhubaneswar"
sonit-moharana-130292122,Sonit Moharana,,https://www.linkedin.com/in/sonit-moharana-130292122/,Sonit,Moharana,"Attended International Institute of Information Technology, Bhubaneswar",https://media-exp1.licdn.com/dms/image/C5103AQFXLngezWeVhw/profile-displayphoto-shrink_200_200/0?e=1592438400&v=beta&t=GXD_Go1ATv_98gs1grJmQi0ey5TU-5T1sE1hpFlJzS0,"Khorda, Orissa, India",,,,,,,,,,,,,,,,,,,,,,,,,,,,,,,,,,,,,,,,,,,,,,,,,,,,,,,,,,,,,,,,,,,,,,,,,,,,,,,,,,,,,,,,,,"International Institute of Information Technology, Bhubaneswar",,,,2012,2016,,,,,,,,,,,,,,,,"""""",,3,,,,,,,"International Institute of Information Technology, Bhubaneswar"
priyanka-priyadarsini-6715a7175,Priyanka Priyadarsini,,https://www.linkedin.com/in/priyanka-priyadarsini-6715a7175/,Priyanka,Priyadarsini,"Student at International Institute of Information Technology, Bhubaneswar",https://media-exp1.licdn.com/dms/image/C5103AQHiNBPVZxrTaw/profile-displayphoto-shrink_200_200/0?e=1592438400&v=beta&t=UDO43cKG8HnEoC68gVRiQJZ_fm0rDjTQ1Y2RLE7RjIM,India,,,,,,,,,,,,,,,,,,,,,,,,,,,,,,,,,,,,,,,,,,,,,,,,,,,,,,,,,,,,,,,,,,,,,,,,,,,,,,,,,,,,,,,,,,"International Institute of Information Technology, Bhubaneswar",BTech - Bachelor of Technology,Computer Software Engineering,,2017,2021,,,,,,,,,,,,,,,,"""""",7,3,,Computer Software,,,,,Narendra Modi; Oracle; IBM; Dell; Jeff Weiner; Cisco
akash-mahajan-717b5b150,Akash Mahajan,,https://www.linkedin.com/in/akash-mahajan-717b5b150/,Akash,Mahajan,"Student at International Institute of Information Technology, Bhubaneswar","data:image/gif;base64,R0lGODlhAQABAIAAAAAAAP///yH5BAEAAAAALAAAAAABAAEAAAIBRAA7","Khorda, Orissa, India",,,,,,,,,,,,,,,,,,,,,,,,,,,,,,,,,,,,,,,,,,,,,,,,,,,,,,,,,,,,,,,,,,,,,,,,,,,,,,,,,,,,,,,,,,"International Institute of Information Technology, Bhubaneswar",Bachelor of Technology - BTech,Electrical and Electronics Engineering,,2017,2021,,,,,,,,,,,,,,,,"""""",,2,,,,,,,Deloitte; Satya Nadella; Oracle; Lean Six Sigma; Machine Learning and Data Science; Bill Gates
amrita-priyadarshini-panda-05388111b,Amrita Priyadarshini Panda,,https://www.linkedin.com/in/amrita-priyadarshini-panda-05388111b/,Amrita,Panda,"Student at International Institute of Information Technology, Bhubaneswar   placed at Dell international services","data:image/gif;base64,R0lGODlhAQABAIAAAAAAAP///yH5BAEAAAAALAAAAAABAAEAAAIBRAA7","Khorda, Orissa, India",,,,,,,,,,,,,,,,,,,,Self employed,Student,Aug-13,PRESENT,,India,https://www.linkedin.com/search/results/all/?keywords=Self%20employed,,,,Self employed,Student,Aug-13,PRESENT,,,https://www.linkedin.com/search/results/all/?keywords=Self%20employed,,,,,,,,,,,,,,,,,,,,,,,,,,,,,,,,,,,,,,,,,,,,,,,,,,,,,,"International Institute of Information Technology, Bhubaneswar",Bachelor of Technology (B.Tech.),Information Technology,,2013,2017,,,,,,,,,,,,,,,,"""Microsoft Office : 0, Microsoft Excel : 0, Microsoft Word : 0, Microsoft PowerPoint : 0, html : 0, JavaScript : 0, .NET Framework : 0, C : 0, C++ : 0, Core Java : 0, """,,3,,Information Technology & Services,,,,,"Dell; Recode; International Institute of Information Technology, Bhubaneswar"
sonashree-panda-674004b0,Sonashree Panda,,https://www.linkedin.com/in/sonashree-panda-674004b0/,Sonashree,Panda,"Student at International Institute of Information Technology ,Bhubaneswar","data:image/gif;base64,R0lGODlhAQABAIAAAAAAAP///yH5BAEAAAAALAAAAAABAAEAAAIBRAA7","Cuttack, Orissa, India",,,,,,,,,,,,,,,,,,,,,,,,,,,,,,,,,,,,,,,,,,,,,,,,,,,,,,,,,,,,,,,,,,,,,,,,,,,,,,,,,,,,,,,,,,"International Institute of Information Technology ,Bhubaneswar",,,,2012,2016,,,,,,,,,,,,,,,,"""""",,3,,,,,,,
