placiddisciple,Abhijit Routray,,https://www.linkedin.com/in/placiddisciple/,Abhijit,Routray,RedSeer | IIM Lucknow,https://media-exp1.licdn.com/dms/image/C4E03AQEhORRmQPYNVA/profile-displayphoto-shrink_200_200/0?e=1592438400&v=beta&t=s1EgKaIqiC-WcnQQpRi97-9wNRhMsQaWlAWSMYQD8ME,"Bengaluru, Karnataka, India",,,,,,,,,,,,,,,,,,,,RedSeer,Senior Consultant,Apr-19,PRESENT,,"Bengaluru Area, India",https://www.linkedin.com/company/redseer,redseer,,,Hinduja Group Limited,Associate - Hinduja Leadership Programme,Jun-18,Mar-19,,"Mumbai Area, India",https://www.linkedin.com/company/hinduja-group,hinduja-group,,,Marico Limited,Marketing Intern,Apr-17,May-17,,"Mumbai, Maharashtra, India",https://www.linkedin.com/company/maricolimited,maricolimited,,,Samsung R&D Institute India-Delhi,Engineer,Jul-14,Jun-16,,"Sector 126, Noida",https://www.linkedin.com/company/samsung-electronics,samsung-electronics,,,,,,,,,,,,,,,,,,,,,,,,,,,,,,,,,"Indian Institute of Management, Lucknow",Post Graduate Diploma in Management.,Marketing and Strategy,7.82,2016,2018,,"International Institute of Information Technology, Bhubaneswar",Bachelor of Technology,Information Technology,8.36,2010,2014,,,,,,,,,"""""",1418,2,,Management Consulting,39,"Debasish Jena, Prayas Purusottam",Debasish Jena,Prayas Purusottam,Shradha Sharma; Narendra Modi; Boston Consulting Group (BCG); LinkedIn; Goldman Sachs; McKinsey & Company
sohamshashank,Shashank Sharma,,https://www.linkedin.com/in/sohamshashank/,Shashank,Sharma,Data Scientist at Apple,https://media-exp1.licdn.com/dms/image/C5103AQEozu-BUx1Vww/profile-displayphoto-shrink_200_200/0?e=1592438400&v=beta&t=zdKjGw7v4pJRHrnaHjflnjrcmqWuR5axFkrS5tKsGdg,"Bengaluru, Karnataka, India",,Mar-04,"With a research background in Machine Learning and NLP, I am always fascinated with Data Science and it reflects in all my professional experiences. - Published 5 research papers in international conferences in the domains of Machine learning and NLP. Learning is a never-ending process, especially in the field of Data Science, and I'm continually learning new technologies, taking online courses, and updating my skills and capabilities. Implemented various Machine Learning algorithms.  I am interested in profiles in the areas of - Data Science, Machine Learning, DEEP Learning, Natural Language Processing. Completed Certification Program in Advanced Business Analytics from IIT-Hyderabad.",,,,,,,,,,,,,,http://linguisticresources.weebly.com/,http://saralkitab.weebly.com,,Apple,Data Scientist,Nov-18,PRESENT,.,"Bengaluru, Karnataka, India",https://www.linkedin.com/company/apple,apple,,,Bank of America,Team Leader,Aug-16,Nov-18,"I) Improved customer base by profiling companies based on the 300M banking transactions, which involved clustering similar businesses transaction under one entity by using Machine Learning algorithms and further improved the model by reinforcement learning. ? It enhanced selection of target audience, reduced manual intervention, and decreased false positive cases. ? II) Designed and implemented machine leaning classification methods to classify 300M business transactions based on category and channel type into 60K business entities. * Achieved 95% accuracy in classifying transaction and clearly segregated wrongly classified transactions which reduced the manual intervention upto 80%. ? III) Feature engineered audit evaluation metric records for record classification. IV) Worked on Named Entity Recognization. * Hands on experience on Python ML libraries (Keras, Scikit, H2O) with Kmeans, Phonetic algorithms, Apriori, String Distance algorithms, Random Forest, Naive Bayes, SVM, Regression, Deep Neural Networks see less","Hyderabad, Telangana, India",https://www.linkedin.com/company/bank-of-america,bank-of-america,,,Lera Technologies,Data Analytics Associate,May-15,Jul-16,"? Worked on Analytics projects for Retail and Banking sector. ? For a Banking client, improved performance of loans portfolio and assisted in optimizing strategic and marketing plans. ? Segmented customer based on their demographics and behaviour to identify profitable segments by applying kmeans and knn algorithm, which increased the average loan amount. ? Identified the products for cross sell/ up sell by using Apriori algorithm and suggested best offers for banking products. ? For a Retail client, forecasted customer transactions with optimum re-order quantity to analyze the future requirements and cash flows using Arima and Holt winter?s algorithm. ? Segmented customers based on RFM analysis for targetted marketing. ? Used Splunk Enterprise and SAP BI for developing analytics solutions. see less",,https://www.linkedin.com/company/leratechnologies,leratechnologies,,,Lera Technologies,Research Internship,Jan-15,May-15,Developed an application which measures and detects the contextual polarity of the tweets by the banking customers on twitter.,,https://www.linkedin.com/company/leratechnologies,leratechnologies,,,IIIT Bhubaneswar,M.Tech student,Aug-13,May-15,"Computer Science and Engineering With research areas: Computational Linguistics, Machine Learning, Data Mining","Bhubaneshwar Area, India",https://www.linkedin.com/company/iiit-bhubaneswar,iiit-bhubaneswar,,,,,,,,,,,,,,,,,,,,,,,"International Institute of Information Technology, Bhubaneswar",Master of Technology (M.Tech.),Computer Science,8.7,2013,2015,"Machine Learning, Data Mining, Natural Language Processing, Information Retrieval,",Jawaharlal Nehru Technological University,Bachelor's degree,Computer Science Engineering,,2009,2013,"Graph Theory, Data Communication, Network Security, Database Management, Data Mining, Automata Theory, Operating Systems",Board of Intermediate Education A.P.,XII (Intermediate),"Mathematics, Physics, Chemistry",94%,2006,2008,,"""Data Analytics : 17, R : 19, Machine Learning : 24, Data Mining : 23, Programming : 11, Algorithms : 6, Deep Learning : 0, Statistics : 0, Python : 6, Core Java : 7, SQL : 21, C : 27, HTML : 6, MySQL : 10, Eclipse : 5, C++ : 13, Java : 13, Microsoft Office : 6, TensorFlow : 0, Pandas : 0, PyTorch : 0, NLP : 3, Computational Linguistics : 1, Social Network Analysis : 1, Sentiment Analysis : 4, Text Analytics : 1, Splunk : 0, Web Mining : 1, RapidMiner : 0, Text Mining : 1, Information Retrieval : 5, Predictive Analytics : 1, Predictive Modeling : 1, Cluster Analysis : 1, Scikit-Learn : 0, """,4012,2,,Banking,8,"Debasish Jena, Shibasis Patel",Debasish Jena,Shibasis Patel,IBM; Oracle; Natural Language Processing; Hewlett Packard Enterprise; Satya Nadella; Bill Gates
subhasish-sahu-56394b59,Subhasish Sahu,,https://www.linkedin.com/in/subhasish-sahu-56394b59/,Subhasish,Sahu,Associate marketing manager | Amazon,https://media-exp1.licdn.com/dms/image/C5103AQFn1DGFOXHc3A/profile-displayphoto-shrink_200_200/0?e=1592438400&v=beta&t=iZ6VNRtqqRF5_qftO_N2JKjJLM-6a-rL-SoWggldcA4,"Bengaluru, Karnataka, India",,Nov-23,"Currently I manage merchandising and marketing for the beauty & luxury Beauty category at Amazon. it's an amazing opportunity to understand customer behaviour and target the cohorts with engaging content and drive the beauty FMCG, and beauty indulgence business.  Prior to this I was handling marketing for wireless category. Was responsible for managing merchandising and marketing for brands like xioami, Vivo, Nokia, LG. I also had an amazing Internship experience at Amazon where I got to map the consumer buying behaviour and accordingly curate the merchandising campaigns for the Toys category.  A voracious reader and a foodie who loves to ride different bikes and will travel for food. I appreciate debate and meaningful conversations at all times, coffee makes it much easier actually.",sahu_subhasish,,,,,,,,,,,,,http://subhasishlive.blogspot.com,http://reticentxpressions.tumblr.com/,https://medium.com/@sahu_subhasish,Amazon,Associate Marketing Manager,Apr-18,PRESENT,,"Bengaluru Area, India",https://www.linkedin.com/company/amazon,amazon,,,Amazon,Site merchandiser Intern,Apr-17,May-17,"As a Site Merchandizer, my role involved improving customer experience for the Toys category of Amazon.in. It involved understanding of customer navigation, traffic analysis, customer search behavior and product listing process. Simultaneously, I dealt with various internal teams ranging from category and inventory front to browse teams, search teams, designers and marketers to devise engaging merchandising campaigns and business processes to improve discoverability of the products. see less","Bengaluru, Karnataka, India",https://www.linkedin.com/company/amazon,amazon,,,ITC Infotech,Associate IT Consultant,Aug-14,Jun-16,"Java Developer, Consultant. Involved in design and development of advanced Java based rich web applications for some major clients. Business problems ranged from payroll processing to distribution onboarding systems in BPM.","Bengaluru Area, India",https://www.linkedin.com/company/itc-infotech,itc-infotech,,,Microsoft Student Partner,Microsoft Student Partner,Dec-12,Dec-13,"As an MSP I developed around 15 Windows phone and windows 8 Apps and launched them in the windows store. I took technical sessions in colleges. Drove entries to Microsoft Imagine Cup, an international tech competition.","Bhubaneshwar Area, India",https://www.linkedin.com/search/results/all/?keywords=Microsoft%20Student%20Partner,,,,,,,,,,,,,,,,,,,,,,,,,,,,,,,,,,MICA,PGDM,strategic marketing and communications,,2016,2018,,"International Institute of Information Technology, Bhubaneswar",Bachelor of Technology (B.Tech.),Computer Science,,2010,2014,,"B.J.B. Autonomous College, BBSR, Khurda",Higher secondary education,science,,2008,2010,,"""Microsoft Excel : 5, Microsoft Office : 3, Java : 13, Android Development : 1, Data Structures : 3, Marketing : 2, Marketing Strategy : 1, Social Media Marketing : 1, Market Research : 1, Strategic Communications : 1, Data Analysis : 1, JavaScript : 9, JavaServer Faces (JSF) : 1, Hibernate : 1, Spring Framework : 1, Spring MVC : 1, SQL : 2, MySQL : 4, Microsoft SQL Server : 2, R : 1, SPSS : 1, Primefaces : 1, spring ioc : 1, Android Studio : 1, Data Analytics : 1, """,1036,2,,Internet,13,"Ananta Prasad, Abhishek Srivastava",Ananta Prasad,Abhishek Srivastava,Deloitte; MICA Alumni; Jeff Weiner; Jack Welch; Dell; Bill Gates
anwesh-satapathy-8436845a,Anwesh Satapathy,,https://www.linkedin.com/in/anwesh-satapathy-8436845a/,Anwesh,Satapathy,Software Engineer @ Dell | AI Saturdays Ambassador,https://media-exp1.licdn.com/dms/image/C5103AQGnBjVcbHbK2g/profile-displayphoto-shrink_200_200/0?e=1592438400&v=beta&t=p_AznUU3wxfqW0q1TczHiqHfReo9x6lXogOSJavuTNA,"Bengaluru, Karnataka, India",,,"Dream - Think - Achieve - Inspire is my way of life. I possess strong fundamentals in machine learning, deep learning, data structures, and algorithms.  Currently building scalable ML/DL solutions for various use cases.",anweshsatapathy,,,,,,,,,,,,,,,,Dell EMC,Software Engineer,Jul-18,PRESENT,"? Built an Outlook plugin for large scale emails classification using RNNs, LSTMs and other NLP techniques. Improved the productivity of marketing teams by 7% and it is predicted to grow to 15% during holiday sales. ? Currently working as a backend developer for DCQO (Dell Cart Quote Order) team. Simultaneously researching on a solution for cart abandonment problem at Dell.com. ? Mentored an intern in building a Deep Learning model that classifies auto suggestions for Dell.com search results into relevant categories in real time, and in turn, provides more relevant search results. Deployed the model as an API for integration with other services.","Bengaluru Area, India",https://www.linkedin.com/company/dellemc,dellemc,,,Nurture.AI,Chapter Ambassador for AI Saturdays,Jul-18,PRESENT,? AI Saturdays is a world wide event initiated by Nurture.ai. This event happens every Saturday and aims to help people acquire skills in Artificial Intelligence. ? I co-conduct sessions on Machine Learning and Deep Learning and also coordinate with other co-organizers in managing the logistics for the weekly meetup.,"Bengaluru, Karnataka, India",https://www.linkedin.com/company/nurtureai,nurtureai,,,Dell EMC,Intern Undergrad Associate,Jan-18,May-18,"? Interned with the Dell Search Team. ? Researched site search data in order to identify the top contributing variables for a KPIs (Key Performance Indicators) like RPV (Revenue per Visit), AOV (Average Order Value). ? Was awarded a perfect score of 10.0 in my thesis presentation for my work. It is only awarded to the top 3% amongst 250 students. see less","Bengaluru Area, India",https://www.linkedin.com/company/dellemc,dellemc,,,Quizzeratti,Co-Founder,Aug-16,May-18,"? Co-founder of Quizzeratti, the quiz club of IIIT Bhubaneswar. ? Hosted the IEEE tech quiz for the year 2016 and the Advaita tech quiz 2017. ? Mentored and motivated college mates for various quiz championships.","Bhubaneshwar Area, India",https://www.linkedin.com/search/results/all/?keywords=Quizzeratti,,,,Summer School on Online Security and Privacy,Participant,Jul-17,less than a year,"Participated in a five day machine learning and data analysis based summer school on Online Security and Privacy, conducted by Dr. Ponnurangam Kumaraguru at International Institute of Information Technology, Hyderabad.","Hyderabad Area, India",https://www.linkedin.com/search/results/all/?keywords=Summer%20School%20on%20Online%20Security%20and%20Privacy,,,,"Centre for Geoinformatics Applications on Rural Development (CGARD),NIRD&PR",Data Science Intern,May-17,Jul-17,"? Devised a Population Analysis and Visualisation System (PAVS) as a GUI. ? The system takes census data files as the input and generates requisite analysis and interactive visualisations using data exploratory techniques, machine learning algorithms and visualisation libraries such as Bokeh. ? The objective of the system is to offer insights on the population data and assist government agencies in formulation of policies and decisions. see less","Hyder?b?d Area, India",https://www.linkedin.com/search/results/all/?keywords=Centre%20for%20Geoinformatics%20Applications%20on%20Rural%20Development%20(CGARD)%2CNIRD%26PR,,,,Workshop on Big Data and Hadoop,Participant,May-17,less than a year,"Attended a workshop on Big Data and Hadoop conducted by Institute of Management, Hyderabad.","Hyderabad Area, India",https://www.linkedin.com/search/results/all/?keywords=Workshop%20on%20Big%20Data%20and%20Hadoop,,,,"International Institute of Information Technology, Bhubaneswar",Bachelor's degree,Computer Science,,2014,2018,,,,,,,,,,,,,,,,"""Python : 3, C : 3, C++ : 3, Machine Learning : 2, Data Analysis : 2, Deep Learning : 0, Data Science : 0, Research : 0, Algorithms : 0, Linux : 2, SQL : 2, Java : 1, Git : 1, HTML : 0, CSS : 0, Tableau : 0, Django : 0, Applied Machine Learning : 0, """,1048,2,,Research,62,"SHAIKH MOHAMMED GOUS, Amit Jena",Shaikh Gous,Amit Jena,OPULENCE CV / PROFILE REVIEW Solutions; Narendra Modi; WarnerMedia; Data Scientists; Richard Branson; HireNacks Network
archana-barik-3a4a13105,Archana Barik,,https://www.linkedin.com/in/archana-barik-3a4a13105/,Archana,Barik,Product Designer at Paytm Money,https://media-exp1.licdn.com/dms/image/C5103AQFVhtQeIpVnGw/profile-displayphoto-shrink_200_200/0?e=1592438400&v=beta&t=pHI8DhB8dcExUdh-BUn2cBe8E5Rsl8W_Br6Qsznai2A,"Bengaluru, Karnataka, India",,,"Experienced Frontend Developer with a demonstrated history of working in the information technology and services industry. Have a passion for designing product. Skilled in Sketch, Figma, Marvel,Adobe XD, After effects, Angular 5 and Typescript. Strong engineering professional with a Btech focused in Information Technology from IIIT, Bhubaneswar.",,,,,,,,,,,,,,,,,Paytm Money,Product Designer,Feb-20,PRESENT,,"Bengaluru, Karnataka",https://www.linkedin.com/company/paytmmoney,paytmmoney,,,BOX8,Ul/UX Designer,Jan-19,Feb-20,"* Redesigned the feedback screen resulting in a 50% increase in subjective comments. * Designed the entire delivery executive assignment which decreased the average delivery time by 27.7% and reduced the number of clicks required from 4 to 1 for each assignment. * Built the design system which has enabled better communication between the internal stakeholders such as the developer, product managers, and designers, increasing productivity by 75%. see less",,https://www.linkedin.com/company/poncho-hospitality-private-limited,poncho-hospitality-private-limited,,,StackRoute,Front End Developer,Nov-17,Jan-19,"* Worked closely with the product manager, design team and other engineers to migrate completely Sunbird project from AngularJS to Angular 5. *Designed and implemented developer friendly reusable Angular 5 components and directives. *Built tool to record telemetry events on all devices which are used by the recommendation engine.",,https://www.linkedin.com/company/stackroute,stackroute,,,,,,,,,,,,,,,,,,,,,,,,,,,,,,,,,,,,,,,,,,,"International Institute of Information Technology, Bhubaneswar",Btech,Information Technology,,2013,2017,,,,,,,,,,,,,,,,"""Management : 2, Angular 5 : 3, Sketch App : 1, Web Design : 0, User Experience Design (UED) : 0, User Experience (UX) : 0, Product Design : 0, Mobile Devices : 0, User-centered Design : 0, User Interface Design : 0, Food & Beverage : 0, AngularJS : 2, Microsoft Office : 2, Microsoft Excel : 2, Microsoft Word : 2, PowerPoint : 2, C++ : 2, C : 2, HTML : 2, CSS : 2, Java : 2, JavaScript : 2, MySQL : 1, jQuery : 1, HTML5 : 1, css 3 : 1, Marvel App : 1, Figma : 0, Prototyping : 0, Adobe Photoshop : 0, adobe xd : 0, Public Speaking : 1, Leadership : 1, Team Management : 0, Mean Stack : 0, TypeScript : 0, User Research : 0, sketch : 0, """,,2,,Investment Management,15,"Ananta Prasad, Tapaswin Padhy",Ananta Prasad,Tapaswin Padhy,LinkedIn; Adobe; Behance; Google; User Experience Jobs; Julie Zhuo
ramapinnimty,V N S Rama Krishna Pinnimty,ramakrishnapinnimty@gmail.com,https://www.linkedin.com/in/ramapinnimty/,N S Rama Krishna,Pinnimty,"Former Research Intern at Indraprastha Institute of Information Technology, Delhi",https://media-exp1.licdn.com/dms/image/C5103AQFqUc7UOtBW8w/profile-displayphoto-shrink_200_200/0?e=1592438400&v=beta&t=oGP4Q0xW4u9viv37p9alFP6-zT0w4lWOyHSNNDBwXzQ,"Hyderabad, Telangana, India",,,"Rama is a Data Science aficionado currently working on some of the most intriguing cross-domain problems related to the field of AI. His main areas of interest include Machine Learning, Deep Learning, and Computer Vision. Apart from this, he also loves Competitive Programming and developing Websites & Apps.",,,,,,,,,,,,,,,,,MIDAS-IIITD,Research Intern,Dec-18,May-19,". Project-1: Active/Idle event segmentation, Tool Detection, Phase segmentation, Post-surgery analysis and Compression of Cataract surgery videos using Deep Learning based architectures. . Project-2: A Novel Fast and Interactive Framework for Retrieval of Face Images for Large-scale Databases. . Project-3: Car Insurance estimation by the extent of damage, damaged area segmentation, etc.; using Faster R-CNN and Mask R-CNN.","New Delhi Area, India",https://www.linkedin.com/company/midasiiitd,midasiiitd,,,First American (India),Computer Vision Intern,Jun-18,Aug-18,". An end-to-end Machine Learning Tool was built from scratch to detect, classify and then remove the watermark present in OCR Mortgage documents. The text underlying the watermark which was lost during the removal process was later successfully restored.","Hyderabad, Telangana, India",https://www.linkedin.com/company/first-american-india-pvt-ltd,first-american-india-pvt-ltd,,,"K-Circle Digital Solutions Pvt. Ltd.,",Python Software Development Intern,Dec-16,Jan-17,. Developed an automatic Crash Detection and Emergency Response System ?MyCall? to address the passive safety needs of automotive space. It provides post-accident safety and emergency assistance and also connects various services in the post-accident process to reduce the risk of fatality in the accident.,"Hyderabad, Telangana, India",https://www.linkedin.com/search/results/all/?keywords=K-Circle%20Digital%20Solutions%20Pvt.%20Ltd.%2C,,,,,,,,,,,,,,,,,,,,,,,,,,,,,,,,,,,,,,,,,,,,"International Institute of Information Technology, Bhubaneswar",Bachelor of Technology - BTech,Computer Science and Engineering,8.38 CGPA,2015,2019,I started my journey as a Data Scientist here and so on forth constantly worked on improving my technical skills alongside building my social skills.,"Sri Chaitanya Junior College, Hyderabad - India",Intermediate Education,PCM,96.6,2013,2015,I completed my 11th and 12th standard education here.,"Sri Chaitanya Techno School, Hyderabad - India",Secondary Education,SSC,9.8,2011,2013,I completed my 9th and 10th standard education here.,"""C : 4, Python : 3, C++ : 2, Machine Learning : 2, Deep Learning : 2, Data Analysis : 1, Computer Vision : 1, Data Structures : 0, Algorithms : 0, Big Data : 0, Java : 2, C (Programming Language) : 1, SQL : 0, HTML5 : 0, Cascading Style Sheets (CSS) : 0, CSS : 0, Process Mining : 0, Natural Language Processing : 0, """,,2,,Research,63,"Debasish Jena, Aashish Jawla",Debasish Jena,Aashish Jawla,"IBM; GE Healthcare; J.P. Morgan; Satya Nadella; Machine Vision, Computer Vision, Image Processing in India; Intel Corporation"
arijeetsat,Arijeet Satapathy,arijeetsat@gmail.com,https://www.linkedin.com/in/arijeetsat/,Arijeet,Satapathy,Product Management at Netcore Solutions,https://media-exp1.licdn.com/dms/image/C5103AQGJgndXVLIqvQ/profile-displayphoto-shrink_200_200/0?e=1592438400&v=beta&t=C3bTV9x1rXQyOihcOh7ryJPaB9D3Fem03Godbyb6UfM,"Mumbai, Maharashtra, India",,,"Product guy working on a Marketing SaaS product to deliver features for the next generation MarTech, by orchestrating with cross-functional teams of PMs, engineers and customer success managers. Previously worked on various domains of Product Development based projects in Internet of Things, Smart City Initiative, Machine Learning and Software Defined Networks.",,,,,,,,,,,,,,http://www.github.com/arijeetsat,,,Netcore Solutions,Product Manager,Dec-19,PRESENT,"1. Product Owner for the Journey feature in Smartech, which enhances the targeted marketing campaigns. 2. Achieved an adoption count of 40+ customers currently using this feature. Delivered product demos to cross teams. 3. Lead a high-performing engineering team for the development and delivery of the feature enhancements. 4. Implemented SAFe Agile practice in the development and release of the product features. 5. Wrote user stories and defined requirements for the design and engineering teams. 6. Conducted the daily standup and release management across the product features. 7. Analyzed market trends and modeled potentials for future roadmap. see less","Mumbai Area, India",https://www.linkedin.com/company/netcore-solutions,netcore-solutions,,,Qualki,Co-Founder,Oct-19,PRESENT,,India,https://www.linkedin.com/company/qualki,qualki,,,Inshaan corporation,Co-Founder,Jun-18,PRESENT,The Freelancing Platform for both Online and Offline Customers (www.inshaan.com),,https://www.linkedin.com/company/inshaan-opc-pvt-limited,inshaan-opc-pvt-limited,,,ACM IIIT-Bh Student Chapter,Membership Chair,Aug-19,PRESENT,,,https://www.linkedin.com/company/acm-iiit-bh-student-chapter,acm-iiit-bh-student-chapter,,,ACM IIIT-Bh Student Chapter,Secretary,Aug-18,Jul-19,,"Bhubaneshwar Area, India",https://www.linkedin.com/company/acm-iiit-bh-student-chapter,acm-iiit-bh-student-chapter,,,ACM IIIT-Bh Student Chapter,Core Member,Aug-17,Jul-18,,,https://www.linkedin.com/company/acm-iiit-bh-student-chapter,acm-iiit-bh-student-chapter,,,"International Institute of Information Technology, Bhubaneswar","Secretary, Technical Society",Jun-18,May-19,"Head of The Tech Society of IIIT Bhubaneswar. Responsible for conducting various tech. events , seminars, talks, competition and sessions for beginners and students of IIIT Bhubaneswar.",Bhubaneswar,https://www.linkedin.com/company/international-institute-of-information-technology-bhubaneswar,international-institute-of-information-technology-bhubaneswar,,,"International Institute of Information Technology, Bhubaneswar",Bachelor?s Degree,Information Technology,,2016,2020,,DAV PUBLIC SCHOOL KOTA,CLASS 12TH,SCI-MATHS,,2014,2016,,,,,,,,,"""Product Management : 0, User Experience (UX) : 0, Product Development : 0, Machine Learning : 1, Research : 2, Project Management : 0, Python : 2, C : 4, C++ : 2, Microsoft Office : 2, Java : 2, C (Programming Language) : 1, Leadership : 3, Team Management : 0, Management : 0, Software Defined Networking : 0, GNU Octave : 2, Networking : 0, Product Strategy : 0, """,4447,1,"March 22, 2018",Computer Software,228,"Shivanand Mallik??, Abhishek Gangwar",Shivanand Mallik,Abhishek Gangwar,Verizon; The Accidental Product Manager; Bill Gates; Wipro Limited; Richard Branson; Justin Trudeau
