abhijeetpanda12,Abhijeet Panda,,https://www.linkedin.com/in/abhijeetpanda12/,Abhijeet,Panda,IIIT Hyderabad | GSoC 2018,https://media-exp1.licdn.com/dms/image/C5103AQFCu0GXmXk0RA/profile-displayphoto-shrink_200_200/0?e=1592438400&v=beta&t=Yyw04mqXiGt517RpUngyAk5jkzAxYpJQDyLeBqDvzFU,"Hyderabad, Telangana, India",,,,,,,,,,,,,,,,,,,,Walmart Labs India,Software Engineering Intern,May-19,Jul-19,,"Bengaluru Area, India",https://www.linkedin.com/company/walmartlabsindia,walmartlabsindia,,,Python Software Foundation,Google Summer of Code 2018,May-18,Aug-18,,,https://www.linkedin.com/company/python-software-foundation,python-software-foundation,,,Aptus Data Labs - a Data Engineering & Advanced Analytics firm,Data Science Intern,Jan-18,Apr-18,,"Bengaluru Area, India",https://www.linkedin.com/company/aptusdatalabs,aptusdatalabs,,,NIT -Rourklea,Research Intern,May-16,Jul-16,"SOCIAL NETWORK ANALYSIS USING BIG DATA TECHNIQUES Worked on an Algorithm to detect communities in Social Networks using the small world phenomenon. Implemented the Algorithm using MAP-REDUCE programming model, on an Apache Hadoop Cluster.",Rourkela,https://www.linkedin.com/company/nit--rourklea,nit--rourklea,,,,,,,,,,,,,,,,,,,,,,,,,,,,,,,,,International Institute of Information Technology,Master of Technology - MTech,Computer Science,,2018,2020,,IIIT Hyderabad,Master of Technology - MTech,Computer Science,,2018,2020,,"International Institute of Information Technology, Bhubaneswar",Bachelor?s Degree,Computer Science,,2014,2018,,"""Python : 2, Big Data : 0, Apache Spark : 0, Algorithms : 1, Machine Learning : 0, Programming : 1, Data Science : 0, Hadoop : 0, Java : 1, C : 0, C++ : 0, R : 0, C (Programming Language) : 1, """,,2,,Computer Software,46,"Shibasis Patel, Ananta Prasad",Shibasis Patel,Ananta Prasad,Daniel Goleman; Richard Branson; Algorithms & Optimization; Jeff Weiner; Infosys; Dell
rupali-pradhan-683995122,Rupali Pradhan,,https://www.linkedin.com/in/rupali-pradhan-683995122/,Rupali,Pradhan,Senior Executive - HR at Manipal Global Education Services,https://media-exp1.licdn.com/dms/image/C5103AQGkU-wKfXHCCQ/profile-displayphoto-shrink_200_200/0?e=1592438400&v=beta&t=5L6Q-5h8KWG-X-F10SLtMosTKG9wPa1Ypoio7YdWips,"Bengaluru, Karnataka, India",,Jan-25,"A B.E Electrical and Electronics graduate from IIIT Bhubaneshwar and a MBA HR from XIMB, I have always been on the lookout for a challenging and rewarding career opportunity. I am currently working as a HRBP with Manipal Global Education Services responsible for managing and providing end to end HR service delivery to business by proactively partnering with business divisons, understanding business requirements and implementing HR services as per policy and processes.",,,,,,,,,,,,,,,,,Manipal Global Education Services,Senior Executive -HR,Jun-18,PRESENT,#NAME?,"Bengaluru Area, India",https://www.linkedin.com/company/manipal-global-education-services,manipal-global-education-services,,,Larsen & Toubro,Summer Intern,Apr-17,May-17,"? Carried out competency mapping for Supervisory grade employees working for Shared Services Centre at both Mumbai and Pune office ? Designed questionnaires for both managers and employees to conduct survey for identifying the skill gap ? Identified the training needs of employees, designed training content and prepared an annual training calendar ? Conducted a training session on Soft Skills see less","Mumbai Area, India",https://www.linkedin.com/search/results/all/?keywords=Larsen%20%26%20Toubro,,,,ITC Infotech,Associate IT Consultant,Aug-14,Jun-16,"? Development of IPs for Digital Testing ? including the UAM framework ? Tool Analysis and POC (analyzed over 15+ testing tools and has given recommendation on its usage) ? Customer relationship building by demonstrating digital readiness testing services (being the single point of contact for the customer & internal teams in the projects that I had worked with) ? Analyzed and carried out User Experience Testing on Staff Travel System application of Qatar Airways ? Developed the idea for doing various Proof of Concepts for Cathay Pacific, Fairmont project ? Assisted the HR in on-boarding process of the interns and campus recruits see less","Bengaluru Area, India",https://www.linkedin.com/company/itc-infotech,itc-infotech,,,,,,,,,,,,,,,,,,,,,,,,,,,,,,,,,,,,,,,,,,,Xavier Institute of Management,Master of Business Administration (MBA),"Human Resources Management/Personnel Administration, General",7.5,2016,2018,,"International Institute of Information Technology, Bhubaneswar",Bachelor of Technology (B.Tech.),Electrical and Electronics Engineering,8.55,2010,2014,,,,,,,,,"""Employee Relations : 1, Employee Engagement : 1, Onboarding : 0, Talent Acquisition : 0, Shared Services : 0, Human Resources (HR) : 0, Employer Branding : 0, learning and development : 0, Talent management : 0, Exit Process : 0, Business partnering : 0, """,,2,,Education Management,9,"Prayas Purusottam, Tirthankar Majumder",Prayas Purusottam,Tirthankar Majumder,Wipro Digital Operations and Platforms; Unilever; Accenture; Philips; EY; Boston Consulting Group (BCG)
anil-samal-307b7764,Anil Samal,,https://www.linkedin.com/in/anil-samal-307b7764/,Anil,Samal,"MBA(IB) Candidate at IIFT, Batch of 2019-21 || ITC Limited || Reliance T.U.P 5.0 Campus Finalist",https://media-exp1.licdn.com/dms/image/C5103AQFT6aUnGE8pBw/profile-displayphoto-shrink_200_200/0?e=1592438400&v=beta&t=6soB8_1tZOvY1X5oUvonzI9i763px7yo7AMjDMCeDoI,"Bengaluru, Karnataka, India",,Mar-27,"A smart and practical person in constant pursuit to be the best version of himself and keep on learning to keep update myself with the industry standard. Currently pursuing my MBA (International Business) from the Indian Institute of Foreign Trade, New Delhi, Class of 2019-2021. A former Software Engineer with BTech in Computer Science Engineering from IIIT Bhubaneswar.",,,,,,,,,,,,,,,,,Indian Institute of Foreign Trade,"Senior Cell Coordinator -  Quizardry, The Quizzing cell of IIFT",Oct-19,PRESENT,,"Kolkata, West Bengal",https://www.linkedin.com/company/indian-institute-of-foreign-trade,indian-institute-of-foreign-trade,,,ITC Infotech,SAP Consultant,Jul-16,Jun-19,"1. Implementation of new SAP Fiori applications for Finance custom reports. It includes transactional and Analytical applications. Custom reports include showing data in Graph, Chart, and Geo-spatial format. 2. Complete Customer Order Management: Developed a Mobility Product for 600+ Salesforce. This involves the creation of sales order in SAP, and follow-up with the production planning cell to ensure timely production so that material reaches the customer on time. 3. Developed a Transportation and Logistics Management System mobile solution on the cloud. This solution helped the company to operate their fleets of vehicles efficiently through mobile applications and helped the company to reduce their latency time by 40% and 60 % less manual checks to be done. 4. Working with an exceptional group of consultants & led the delivery of key aspects of projects within the area of SAP Mobile Solution for ERP. 4. Proficient & expertise in gathering requirements and developing Technical Design. 5. Taking the change requests as per the requirement and implement the changes. Changes may contain code modification, theme changes; PCD objects changes, UI modification see less","Bengaluru Area, India",https://www.linkedin.com/company/itc-limited,itc-limited,,,"International Institute of Information Technology, Bhubaneswar",Placement Committee Coordinator,Jul-13,Dec-15,Elected as a Senior coordinator of the Placement Committee by 200+ students of IIIT Bhubaneswar ? Worked in a 12 member team for achieving 100% summer placements for the batch of IIIT ? 240 students (Batch of 2010-14) and (Batch of 2011-15) in the number of new roles with the addition of new recruiters ? Supervised and coordinated with 4 support committees with a combined strength of 20+ members ? Acted as the Treasurer of the Placement Committee see less,Bhubaneswar,https://www.linkedin.com/company/iiit-bhubaneswar,iiit-bhubaneswar,,,Central Tools and Training Centre(CTTC),Trainee,Apr-14,May-14,"VLSI Trainee:Learnt VHDL,Verilog,PLD,CMOS,NMOS,Xilinx software","Bhubaneshwar Area, India",https://www.linkedin.com/search/results/all/?keywords=Central%20Tools%20and%20Training%20Centre(CTTC),,,,,,,,,,,,,,,,,,,,,,,,,,,,,,,,,,Indian Institute of Foreign Trade,Master of Business Administration - MBA,International Business,,2019,2021,,"International Institute of Information Technology, Bhubaneswar",Bachelor of Technology (B.Tech),Electronics and Telecommunication Engineering,08-Oct,2012,2016,Placement Coordinator of Training and Placement cell (2013-2105),Kendriya Vidyalaya,10(+2) Intermediate,Science,86.2,2009,2011,"School Captain,1. Won 1st runner up prize in Terra Quiz2. Won 1st Prize in Science Exhibition","""Product Management : 1, Business Strategy : 1, Enterprise Resource Planning (ERP) : 0, Operations Management : 1, Usability : 0, Usability Testing : 0, SQL : 0, HTML : 3, R : 0, C++ : 1, C : 3, LaTeX : 0, Microsoft Office : 1, Management : 0, Team Management : 0, OData : 0, Data Analytics : 0, """,928,2,,Information Technology & Services,20,"Debasish Jena, Navanita Nayak",Debasish Jena,Navanita Nayak,"Adobe; Indian Institute of Foreign Trade; Shell; SAP Technology; Walmart Labs India; International Institute of Information Technology, Bhubaneswar"
satyam-kumar-behera,Satyam Kumar Behera,,https://www.linkedin.com/in/satyam-kumar-behera/,Satyam,Behera,Penetration Tester | Consultant | PwC,https://media-exp1.licdn.com/dms/image/C5103AQFCrzwO3X1eIg/profile-displayphoto-shrink_200_200/0?e=1592438400&v=beta&t=MbJv8xticjGQ4i7fKxp2PTREZHJYMAID1fWlW-6RAjU,"Mumbai, Maharashtra, India",,,"A passionate learner whose skills include penetration testing, securing network infrastructure, Linux administration, and financial management. I have been assessing mobile applications (Android, iOS, and KaiOS), web applications, servers and network devices on-site for almost two years now.  When I am not working, I am actively involved in researching vulnerabilities and exploits. I am also a technology gadget enthusiast who likes to stay updated on mobile and desktop hardware enhancements. I am a firm believer that apart from technical skills, soft skills are crucially important in building one's career.  Other passions include: 1. Content creation at YouTube 2. Investing 3. Improving linguistic skills in English",,,,,,,,,,,,,,,,,PwC India,Consultant,Jul-18,PRESENT,"Job responsibilities: - Penetration testing of web & mobile applications, servers and APIs. - Penetration testing of Wireless protocols (WPA 2 Personal and WPA 2 Enterprise)  Experience include: - Responsible for Applications, APIs and RFID VAPT for India's largest telecom service provider - Conducted WiFi penetration testing for one of India's top pharmaceutical firms - Conducted web, iOS, Android and API VAPT for Singapore's largest medical and travel security services firm - Conducted web and network VAPT for Saudi Arabia's govt. body see less","Mumbai, Maharashtra, India",https://www.linkedin.com/company/pwc-india,pwc-india,,,YouTube,Content Creator,2015,Dec-18,,,https://www.linkedin.com/company/youtube,youtube,,,Network Intelligence (I) Pvt. Ltd.,Cyber Security Analyst,Jul-17,Jun-18,"Job responsibilities: ? Network Vulnerability Assessment and Penetration Testing ? Web Application and Penetration Testing (on business applications in the areas of Banking, Finance, and Insurance.) ? API Testing ? OS Hardening (Linux and Windows servers) ? Monitoring and Administration of Intrusion Prevention System, Data Loss Prevention and Advanced Threat Protection  Experience includes: ? Identifying and reporting issues to the application/server administrators for various National/International banks and organizations. ? Handling the entire organizational application and network security. see less","Mumbai, Maharashtra, India",https://www.linkedin.com/company/nii-consulting,nii-consulting,,,,,,,,,,,,,,,,,,,,,,,,,,,,,,,,,,,,,,,,,,,"International Institute of Information Technology, Bhubaneswar",Bachelor?s Degree,Electronics and Telecommunications Engineering,7.29 GPA,2013,2017,,,,,,,,,,,,,,,,"""Penetration Testing : 7, Mobile Application Security : 2, Web Application Security : 2, Network Security : 8, Vulnerability Assessment : 1, Computer Networking : 0, Linux System Administration : 1, Application Security : 3, Enterprise Network Security : 0, Online Content Creation : 4, Web Application Firewall : 1, IT Security Operations : 0, Radio-Frequency Identification (RFID) : 0, Intrusion Prevention System : 0, Data Loss Prevention : 0, Wireless Security : 0, IT Consulting : 0, API Security : 0, """,,2,,Computer & Network Security,20,"Chris Roberts, Alan M. Cordeiro de Lacerda (alacerda)",Chris Roberts,Alan Cordeiro De Lacerda,Wipro Limited; McKinsey & Company; Symantec; Deloitte; PwC; Satya Nadella
nishant-choudhary-97739b145,Nishant Choudhary,,https://www.linkedin.com/in/nishant-choudhary-97739b145/,Nishant,Choudhary,Lead Data Scientist at ValueLabs,https://media-exp1.licdn.com/dms/image/C5103AQFZ3JOtcxDOWg/profile-displayphoto-shrink_200_200/0?e=1592438400&v=beta&t=wESLWlGGOVt-WdsO6EojLFWjUXOQAuZPmT7ZvinS_Zg,"Hyderabad, Telangana, India",,,"Data Scientist with 3.5+ yrs of experience in designing and developing Machine learning solutions for Health insurance domain for a product. Previously worked for handling Data science oriented solutions for  IT operations in a SAAS Product. Productionize data science workflow in AIOPS( Artificial Intelligence for IT Operations) and Healthcare domain.  Major Working Areas: Machine Learning Deep learning Time Series Big Data Analytics.  Specialities: ML pipeline Implementation. Big data(Kafka, Spark Streaming). Data Analysis(ML use case discovery). Micro services. Hive,Ambari.   Domain Experience: ITOP(SAAS Product). Healthcare & Insurance(HIPAA).",,,,,,,,,,,,,,,,,ValueLabs,Lead Data Scientist,Mar-19,PRESENT,Currently working in Healthcare insurance domain for a Product.,"Hyderabad Area, India",https://www.linkedin.com/company/valuelabs,valuelabs,,,OpsRamp,Data Science Engineer(Product Management Team ) at OpsRamp,Feb-18,Mar-19,"My role is to identify use cases which adds value to the product by analyzing the huge amount of data and finally need to decide which Machine learning, AI techniques to implement the discovered use cases.  Responsibilities: Get the data from the source(either through API Calls or generated reports). Data preprocessing. Exploratory Analysis and Visualizations. Use case identification. Deriving Ml solutions for identified use cases. see less",India,https://www.linkedin.com/company/opsramp,opsramp,,,OpsRamp,Data Scientist,Feb-18,Sep-18,"Responsible for implementing Machine learning, AI and Deep learning solutions in a product.  Key Responsibilities: Implementing Machine learning solutions for real customers in a product. Created microservice to execute or communicate the different language environment.  Implemented the following features: LSTM(Deep learning) for event correlation through ML pipeline structure. Time series forecasting implementation as preventive analytics. change detection (a use case for Anomaly detection). see less","Hyderabad Area, India",https://www.linkedin.com/company/opsramp,opsramp,,,Infosys,System Engineer,Mar-16,Jan-18,"Worked in different technologies in an organization which are as under: SAP ABAB developer. RPA(Robotics Process Automation) developer. Tools: Pega Robotics Studio, UI PATH, Automation Anywhere.","Hyderabad Area, India",https://www.linkedin.com/company/infosys,infosys,,,,,,,,,,,,,,,,,,,,,,,,,,,,,,,,,"International Institute of Information Technology, Bhubaneswar",Master of Technology - MTech,Computer Science engineering,8.60 CGPA,2013,2015,,Lovely Professional University,Bachelor of Technology - BTech,computer science engineering,8.06 CGPA,2007,2011,,,,,,,,,"""SQL : 1, Microsoft SQL Server : 1, HTML : 1, Deep Learning : 1, Microsoft Office : 1, C : 1, Matlab : 1, Python : 1, R : 1, Ui Path : 1, Tableau : 1, C++ : 1, pega robotic studio : 1, """,,2,,Information Technology & Services,20,"Debasish Jena, Mrityunjay P",Debasish Jena,Mrityunjay P,Big Data Analytics and Predictions; ValueLabs; GeeksforGeeks; International School of Engineering (INSOFE); Lovely Professional University; Artificial Intelligence (AI) and Machine Learning
abhilash-bhardwaj-6000b7b4,Abhilash Bhardwaj,,https://www.linkedin.com/in/abhilash-bhardwaj-6000b7b4/,Abhilash,Bhardwaj,Trainee Scientist at BARC | AIR 19 GATE CS'20 | Selected for DRDO | Formerly selected for IISc Banglore | B.Tech CSE,https://media-exp1.licdn.com/dms/image/C5103AQGIHtQ53HmMtQ/profile-displayphoto-shrink_200_200/0?e=1592438400&v=beta&t=0gK5pUZUB02DSOC60SGj3l_eV4DUlrd4oUWx_Dpe4dg,"Mumbai, Maharashtra, India",,,"Currently under the training of Bhabha Atomic Research Centre (BARC). Exploring nuclear science, machine intelligence, computer vision, system security and interdisciplinary areas of research and development.",,,,,,,,,,,,,,,,,BARC,Trainee Scientist,Aug-19,PRESENT,Undergoing 1 year of training program at BARC Training School.,"Mumbai Area, India",https://www.linkedin.com/company/barc,barc,,,Dell,Undergraduate Intern,Jun-18,Jul-18,Worked with Config Sentinel Team. Developed an automated testing application for eventing systems. Also developed a toolset for monitoring and analysis purpose.,"Bengaluru Area, India",https://www.linkedin.com/company/dell,dell,,,Vivaah Centre,Application Developer,May-17,Jul-17,"Developed an intranet web application for complete database solution, client interaction and lead management. Application was built using PostgreSQL and Express.js with integration with Google APIs for automated email alert and service support.","Bhubaneshwar Area, India",https://www.linkedin.com/search/results/all/?keywords=Vivaah%20Centre,,,,,,,,,,,,,,,,,,,,,,,,,,,,,,,,,,,,,,,,,,,,"International Institute of Information Technology, Bhubaneswar",Bachelor of Technology (B.Tech.),Computer Science and Engineering,9.57 CGPA,2015,2019,University Rank 1 (Batch 2015-19),St Karen's secondary school,,,"+2 (with PCM and Computer Science), 93.4 %",2012,2014,School rank 1 in CBSE AISSCE - 2014 Examination.,,,,,,,,"""Object-Oriented Programming (OOP) : 1, Data Structures : 1, Node.js : 0, Algorithms : 1, Software Testing : 0, Computer Networking : 1, Test Driven Development : 0, Network Security : 0, Machine Learning : 0, C : 1, Java : 0, SQL : 0, Python : 0, C++ : 0, ASP.NET : 0, ASP.NET Core : 0, Blockchain : 0, C# : 0, Operating Systems : 0, Relational Databases : 0, Team Management : 0, Leadership : 0, Public Speaking : 0, Web Application Development : 0, Pattern Recognition : 0, Computer Architecture : 0, """,580,2,,Research,115,"Abhishek Gangwar, Venkat Nagaram",Abhishek Gangwar,Venkat Nagaram,"Narendra Modi; BARC; Adobe; Ola (ANI Technologies Pvt. Ltd); International Institute of Information Technology, Bhubaneswar"
shafeeqrahman96,Syed Shafeeq Ur Rahman,shafeeqrahman96@gmail.com,https://www.linkedin.com/in/shafeeqrahman96/,Syed,Rahman,Technology Risk Analyst at EY,https://media-exp1.licdn.com/dms/image/C5103AQG5SiuEP5h0Sw/profile-displayphoto-shrink_200_200/0?e=1592438400&v=beta&t=c4rmbCJqo2iCWJrFlOAwFEtEiVFPADf803Cecoz6FXc,"Bengaluru, Karnataka, India",,,"A 23-year-old Computer Science undergrad student at IIIT Bhubaneswar, currently working as a Technology Risk Analyst in EY. A major area of my work is in SAP ITGC assessment. EY Analytics Bronze badge certified in Data Visualization in 2020.",,,,,,,,,,,,,,,,,EY,Technology Risk Analyst,Jun-19,PRESENT,,"Bengaluru, Karnataka, India",https://www.linkedin.com/company/ernstandyoung,ernstandyoung,,,Indian Railways,Research Project Intern,Jan-19,Apr-19,Complete paper implementation and presentation on Prioritized Fair Round Robin Algorithm With Variable Time Quantum. A project in the subject of Operating System.,"Lucknow, Uttar Pradesh, India",https://www.linkedin.com/company/indian-railways-new,indian-railways-new,,,Indian Railways,Android Developer Intern,Jun-18,Jul-18,"Worked on a file and information sharing application for employees at Research Designs and Standard Organization (RDSO), Lucknow.","Lucknow, Uttar Pradesh, India",https://www.linkedin.com/company/indian-railways-new,indian-railways-new,,,"International Institute of Information Technology, Bhubaneswar","Secretary, News and Publications Society",Jun-17,Jun-18,,"Bhubaneshwar Area, India",https://www.linkedin.com/company/international-institute-of-information-technology-bhubaneswar,international-institute-of-information-technology-bhubaneswar,,,Internshala,Student Partner,Sep-17,Apr-18,"Working as a Student Partner for Internshala under the program Internshala Student Partner 8.0, for IIIT Bhubaneswar",,https://www.linkedin.com/company/internshala,internshala,,,Nettech Private Limited,Summer Trainee,Jun-16,less than a year,,IIT Kharagpur,https://www.linkedin.com/company/nettech-private-limited,nettech-private-limited,,,,,,,,,,,,,"International Institute of Information Technology, Bhubaneswar",Bachelor's degree,Computer Science,,2015,2019,Computer Science Student,"St. Mary's Convent Inter College,Lucknow.",Schooling,Science,,2001,2014,,,,,,,,,"""IT Audit : 0, IT Risk Management : 0, SAP ERP : 0, Programming : 1, Mathematics : 0, Data Visualization : 0, Android : 0, Blogger : 1, Java : 0, HTML : 0, C : 1, C++ : 0, JavaScript : 0, Microsoft Excel : 0, Microsoft Word : 0, Microsoft PowerPoint : 1, WordPress : 1, C (Programming Language) : 2, Leadership : 2, Teamwork : 1, Public Speaking : 1, Team Leadership : 1, """,884,1,"September 27, 2019",Management Consulting,154,"Shivanand Mallik??, Abhishek Gangwar",Shivanand Mallik,Abhishek Gangwar,Kiran Mazumdar Shaw; Katya Andresen; Daniel Burrus; Hewlett Packard Enterprise; Deloitte; Microsoft
gourab-chattopadhyay,Gourab Chattopadhyay,,https://www.linkedin.com/in/gourab-chattopadhyay/,Gourab,Chattopadhyay,Graduate from IIIT Bhubaneswar | Software Engineer at Hiver,https://media-exp1.licdn.com/dms/image/C4D03AQG1OADAbSdb8A/profile-displayphoto-shrink_200_200/0?e=1592438400&v=beta&t=JzHHJg7LSovy6tf08JybwQVVghzI0_pVQvTiq3aUYaI,"Bengaluru, Karnataka, India",,May-05,"I am a conscientious self-starter, who can strategize and prioritize effectively to accomplish multiple tasks. Trained IT Professional with knowledge in Full Stack Development, OOP, Machine Learning and Computer Fundamentals. At my current workplace, I have received an award and an appreciation for my work in automation.   Looking to learn and grow as I walk through my career path and make the best use of my skills.",,,,,,,,,,,,,,,,,Hiver,Software Engineer,Nov-19,PRESENT,,"Bengaluru Area, India",https://www.linkedin.com/company/hiverhq,hiverhq,,,MetricStream,Member Of Technical Staff,Apr-19,Oct-19,,"Bengaluru, Karnataka, India",https://www.linkedin.com/company/metricstream,metricstream,,,ITC Infotech,Associate IT Consultant,Jul-18,Apr-19,,"Bengaluru, Karnataka, India",https://www.linkedin.com/company/itc-infotech,itc-infotech,,,JunctionTV,Intern,May-17,Jul-17,,"Kolkata Area, India",https://www.linkedin.com/company/junction-tv,junction-tv,,,Coal India Limited,Summer Internship,Jun-16,Jul-16,,"Kolkata, West Bengal, India",https://www.linkedin.com/company/coal-india-limited,coal-india-limited,,,,,,,,,,,,,,,,,,,,,,,"International Institute of Information Technology, Bhubaneswar",Bachelor of Technology (B.Tech.),Information Technology,7.7,2014,2018,,Indian Naval Academy,,,,2013,2014,,"St. Patrick's H.S. School, Asansol",HIgh School,Theoretical and Mathematical Physics,,2000,2013,,"""Python : 0, C : 11, Data Structures : 0, Programming : 5, Project Management : 4, Software Development Life Cycle (SDLC) : 0, Web Services : 0, Object-Oriented Programming (OOP) : 0, Machine Learning : 0, Artificial Intelligence (AI) : 0, Algorithms : 0, Front-end Development : 0, C++ : 6, ABAP : 2, SAP ERP : 0, HTML : 9, Java : 6, JavaScript : 5, PHP : 5, Cascading Style Sheets (CSS) : 4, Microsoft Excel : 3, Microsoft PowerPoint : 3, SQL : 3, AJAX : 3, json : 3, Photoshop : 2, Microsoft Office : 2, Microsoft Word : 2, MySQL : 0, UiPath : 0, XML : 0, jquery : 0, ajax : 0, Python (Programming Language) : 0, JSON Web Token (JWT) : 0, TensorFlow : 0, Representational State Transfer (REST) : 0, Pandas (Software) : 0, Public Speaking : 8, Management : 4, Team Management : 0, Back-End Web Development : 0, """,714,2,,Computer Software,52,"Abhishek Gangwar, Neel Achary",Abhishek Gangwar,Neel Achary,"JOBS, Internships, Recruitments and Tips & News to enhance Career; St. Patrick's H S School Asansol; Hewlett Packard Enterprise; GE; St. Patrick's Alumni International (SPAI); Oracle"
