ashadipta-pati-6611a6a6,Ashadipta Pati,,https://www.linkedin.com/in/ashadipta-pati-6611a6a6/,Ashadipta,Pati,Senior Blockchain Architect at Carnival Assets Management Company Limited,https://media-exp1.licdn.com/dms/image/C4E03AQGSeNGnvRaHQQ/profile-displayphoto-shrink_200_200/0?e=1592438400&v=beta&t=xCPuuLwHD86IfFd11Ikq8S6_mLiAyFSnUL8AY2X6e1w,"Mumbai, Maharashtra, India",,Jan-20,"Blockchain developer with a demonstrated history of working in the information technology and services industry. Strong engineering professional skilled in Javascript,Blockchain,Bitcoin,Ethereum,Solidity,Smart Contracts, Hyperledger,Truffle, Infura, Metamask,Mist, Ethereum Raiden Network,Ganache-Cli and Ganache-GUI,GitHub, AWS-Lambda,Docker,Cosmos Blockchain",,,,,,,,,,,,,,,,,Carnival Assets Management Company Limited,Senior Blockchain Architect,Jan-20,PRESENT,,Singapore,https://www.linkedin.com/company/tienchat,tienchat,,,FirstBlood,Blockchain Developer,Jun-19,Jan-20,"Cosmos Blockchain- Cosmos-SDK, Customised Namespace chain,Peggy(Bridge for converting ERC-20 token to cosmos compatible tokens) Tendermint, pBFT, POS Develop and update Supply chain Trading Smart Contract for version change . Deploying Smart contract using Truffle Framework, Ganache-CLI and Ganache-GUI, Infura , Metamask Serverless Deploy using AWS Lambda, Creation of Virtual Private Cloud with public and private subnets . Git and GitHub Docker-Installation,Docker Images,Docker Container,,Docker Daemon,Docker Compose,Docker Hub. see less","Mumbai Area, India",https://www.linkedin.com/company/firstblood,firstblood,,,Accenture,Blockchain Developer and ICO Strategist,Dec-18,May-19,"1. Developing REST APIs 2. Working on developing Smart Contracts Supply chain Scenarios. 3. Supporting ICO phases -Pre ,Post and During. 4. Blockchain in Supply chain Industry for Transparency and Traceability. 5. Blockchain in Insurance industry & Real Estate. see less","Kolkata Area, India",https://www.linkedin.com/company/accenture,accenture,,,Capgemini,Associate Consultant-Blockchain,Oct-14,Dec-18,"1. Creating REST APIs using node.js with express.js framework. 2. Handling callback hell via async-await functions and effective use of promise functions. 3. Mongo Db -create database, create collection, insert , find , query, Sort, Delete, Drop Collection. 4. Blockchain overview,Cryptography(Symmetric Key Cryptography,Asymmetric Key Cryptography and Hashing), Bitcoin History,Bitcoin Wallets,Asymmetric Key Cryptography in Blockchain. 5.Development of Smart contracts for Supply Chain(asset tracking) in Remix using Solidity. see less","Kolkata Area, India",https://www.linkedin.com/company/capgemini,capgemini,,,,,,,,,,,,,,,,,,,,,,,,,,,,,,,,,"International Institute of Information Technology, Bhubaneswar",Bachelor in Technology,Electronics and Telecommunication,,2010,2014,,Kendriya Vidyalaya Balasore,High School,,,1998,2010,,,,,,,,,"""Ethereum : 2, Hyperledger : 1, JavaScript : 1, Smart Contracts : 1, Bitcoin : 1, Bitcoin Mining : 1, """,2794,2,,Information Technology & Services,5,"Paul Saad, Surya Mohapatra",Paul Saad,Surya Mohapatra,Accenture; Deloitte; Ethereum.; Satya Nadella; Birlasoft; Facebook
davidbarik,David Barik,,https://www.linkedin.com/in/davidbarik/,David,Barik,"PMP, Prince2, ASM",https://media-exp1.licdn.com/dms/image/C5103AQFRBfOM3rTKxg/profile-displayphoto-shrink_200_200/0?e=1592438400&v=beta&t=0EWqtx5ZN29wfdeSR6Mg8nlSQYbeS78k4fvChGqXBeE,"Bengaluru, Karnataka, India",,Sep-14,"Enterprise Solution Architect with over 8+ years of global leadership experience in designing innovative business solutions for public sector clients across 30+ Nations.  Skilled in Data Integration and cloud computing, information management, application development, and virtualization.  Demonstrated mastery in evaluating requirements for business application integration and service activation.",David_Barik,,,,,,,,,,,,,http://capillary.co.in/,http://eoswares.com/,,Capillary Technologies,Sr. Enterprise Solution Architect,Dec-18,PRESENT,"* Leading strategic initiatives and build unique models to meet client outcomes. * Leading, Anchor, Drive tailored strategic and operational solutions to RFPs/bids/bid defenses in achieving client goals, through optimal costing yet deliverable solutions, at a local, regional and global level. * Ensuring all aspect of the clinical development and operations are considered with the penultimate aim of bringing the client compound to the market. * This includes driving the creation, enhancement, and operationalization of advanced new solutions by leveraging on domain expertise and how to leverage technology support. * Well versed in and operational knowledge to support clinical research planning and overall study approach strategy. * Responsible for strategy and operations planning for clinical trial across full trail life cycle e.g. protocol development, startup, feasibility, patient recruitment, biostatistics, data management, randomization and project management. * Serves as therapeutic and operational expects responsible for developing customized project-specific execution strategies to meet our customers unique development challenges. see less",India & China,https://www.linkedin.com/company/capillary-technologies,capillary-technologies,,,Capillary Technologies,Enterprise Solution Architect,Apr-15,Nov-18,"? Getting into the core of the problem and soliciting requirements at the first step in addressing any given set of requirements. ? Acting as a bridge between a given project or solution and how that project fits into the broader context with the product and offerings. ? Analyzing the information that has collected,consists of answering three architectural questions: (1) What are the key elements of the problem or solution? (2) What are the relationships between them? and (3) How do they combine together to provide value higher up? ? Framing up the integration solutions by creating the conceptual vision of the solution. Typically in the form of a conceptual architectural diagrams, a drawing that shows the major users/channels of the system, the other system it has to interact with, and the major logical functions and data that it must perform or use. ? Communicating the key details to many audiences through architectural viewpoints, such as business, information, application and technology perspectives. ? Actively assisting and consulting various projects. ? Establish project plan baseline: define project scope, secure the necessary resources & plans & monitor all activities ? Drive project execution: track project activities , monitor & handle changes, conflicts & escalations ? Handle customer & stakeholder engagement: manage customer relationship building confidence & trust , ensure project progress arranging meetings & customer events ? Manage project finance: ensure financial system monitoring ? Develop the business: participate to contract preparation & to pre-sales meeting ? Develop the CPM discipline: simplify processes, methods & tools with innovative ideas see less",Global,https://www.linkedin.com/company/capillary-technologies,capillary-technologies,,,Capillary Technologies,Technical Program Manager,Mar-13,Apr-15,"Leading the planning and implementation of project to facilitate the definition of project scope, goals and deliverables. Defining tasks and resource requirements to develop full scale project plans by assembling and coordinating with staff. Managing the budget and resource allocation.Planing and schedule project timelines to track project deliverables using appropriate tools by providing direction and support to team.Constantly monitor and report on the progress of the project to all stakeholders and presenting the reports to define progress, problems and solutions. Implementation and managing project changes and interventions to achieve outputs and project evaluations and assessment of results. ? Managing multiple internal infrastructure projects for software development across internal domains with IT development and engineering utilizing an Agile SDLC methodology. ? Managing multiple application/service development projects and upgrades to move from legacy internal built software to newer technology. ? Working with the business side to understand and develop requirements to deliver to the Team Managers/Stakeholders. ? Managing entire project team from requirements through development, testing, training, implementation, and closure. ? Managing multiple product development projects and managed other PM?s for our data integration Domain. ? Coordinate multiple ERP vendor solutions from order to fulfillment. ? Perform research and analysis of business requirements to develop a complete Customer Relationship Management (CRM) solution utilizing various softwares. see less",Global,https://www.linkedin.com/company/capillary-technologies,capillary-technologies,,,Capillary Technologies,Manager Partner Business,Apr-12,Mar-13,"Insight-driven consumer marketer with experience client and agency side in Retail, Mobile Telecoms and Utilities. Highly entrepreneurial and versatile. Launched and developed Loyalty & CRM programs across a range of brands. Highly motivated and successful people manager.  ? Consulting with potential clients to identify their key business issues ? Gathering essential IT infrastructures and potential business opportunities ? Meeting required targets and analysing data collected ? Developing and building relationships with key stakeholders (internal and external) ? Co-ordinating and supporting SME's marketing and sales teams ? Recognize new customers aligned by key pillars of the business ? Recognize white space opportunities within the customer base ? Development and execution of effective campaigns in reaching top level executives and line-of-business (LOB) managers ? Opportunity qualification, and overall account penetration and maturation strategy ? Responsible for building sales pipeline within an assigned territory ? Undertake background research on target customers? existing and future product portfolios ? Undertake frequent regular telephone and email communication with clients and stakeholders see less",Bangalore,https://www.linkedin.com/company/capillary-technologies,capillary-technologies,,,Webfy,Co-Founder,Oct-11,May-12,"Creating, communicating, and implementing the organization's vision, mission, and overall direction.  Leading, guiding, directing, and evaluating the work of other co-workers, partner and of course client.  Formulating and implementing the strategic plan that guides the direction of the business.  Forming, staffing, guiding, leading, and managing an organization sufficient to accomplish my responsibilities and the strategic plan of the business.  Overseeing the complete operation of an organization in accordance with the direction established in the strategic plans.  Evaluating the success of the organization.  Maintaining awareness of both the external and internal competitive landscape, opportunities for expansion, customers, markets, new industry developments and standards, and so forth.  I frequently represent the organization in civic and professional association responsibilities and activities in the local community, the state, and at the national level.","Mumbai Area, India",https://www.linkedin.com/search/results/all/?keywords=Webfy,,,,Airbus,Research and Development Engineer,Sep-11,Nov-11,"Created interactive programs that mirror the experience of flying as closely as possible.Involved in every step of the process of creating a simulation, from analyzing the aerodynamic models to testing and troubleshooting the finished product. Coordinating with a team of graphic designers, computer programmers and mechanics to put together the many components of the machine, and oversees the entire operation.",,https://www.linkedin.com/company/airbusgroup,airbusgroup,,,Phyxius Softwares Pvt. Ltd,Site Administrator,Nov-09,Feb-11,"I was most closely aligned with the traditional role of webmaster. In addition to the ability to create, approve and publish content, I was responsible for the overall design and functionality of the site within the CMS templates. I was building and integrating modules, modifying administrative features and authorize and set up user profiles for Contributors, Editors and peer Site Administrators for their sites.","New Delhi Area, India",https://www.linkedin.com/search/results/all/?keywords=Phyxius%20Softwares%20Pvt.%20Ltd,,,,"International Institute of Information Technology, Bhubaneswar",M.Tech,Computer Science and Engineering,A,2009,2011,,SRM University,B.Tech,Computer Science and Engineering,A,2005,2009,,,,,,,,,"""CRM : 78, C++ : 49, C : 39, Cloud Computing : 34, Software Development : 22, Customer Relationship Management (CRM) : 19, Project Management : 17, Marketing Strategy : 15, Business Analysis : 13, Business Strategy : 12, Project Planning : 10, Agile Methodologies : 10, Business Development : 9, Strategy : 7, Analysis : 6, Business Intelligence : 6, Algorithms : 4, Web Services : 4, SDLC : 4, Operations Research : 3, Program Management : 3, Data Analysis : 2, Pre-sales : 2, Entrepreneurship : 1, Data Integration : 1, Consulting : 1, Mobile Applications : 0, Java : 35, SQL : 27, HTML : 23, MySQL : 20, Databases : 10, SaaS : 2, Software as a Service (SaaS) : 1, Management : 23, Team Management : 7, Networking : 4, Mobile Application Development : 0, """,,2,,Computer Software,24,"Debasish Jena, Prayas Purusottam",Debasish Jena,Prayas Purusottam,GE; Once a Captain ... Capillary Alumni Group; HH Sheikh Mohammed Bin Rashid Al Maktoum; Accenture; Solution Architect; Ericsson
amlan-anurag,Amlan Anurag,,https://www.linkedin.com/in/amlan-anurag/,Amlan,Anurag,Brand Manager at Times of India,https://media-exp1.licdn.com/dms/image/C4D03AQHU9nLnAuQt7w/profile-displayphoto-shrink_200_200/0?e=1592438400&v=beta&t=SweQUsatCwHdag45KIuJTnv6zR93t1PSFjnHHfSAjXc,"Mumbai, Maharashtra, India",,,"Marketing practitioner with experience in brand management, digital marketing and analytics.  Core competencies include:   1. ONLINE: Search Marketing, Social media management ( Facebook, LinkedIn, Twitter, Instagram, Blogging), Search Engine Optimization, Pay Per Click Advertising, Traffic Building, Conversions and Analytics. 2. OFFLINE: Brand management, Channel management, Marketing management, Sales, Brand Activation, Market Research, Brand penetration, Customer management, Conceptual selling, Business analysis and strategy formulation.",amlan91,,,,,,,,,,,,,,,,Times of India,Brand Manager,Dec-19,PRESENT,,,https://www.linkedin.com/company/times-of-india,times-of-india,,,"Brand Capital, India","Deputy Manager, Brand",Jan-18,Aug-19,"Brand Capital is the BCCL?s investment arm and world's biggest media investment player. ? Building branding and digital strategy for concept brands of Brand Capital. ? Strategizing long term and short term goals of the brand and optimising marketing spends. ? Spearheading design, development and implementation of brand development work ? Developed ATL, BTL and online campaigns to drive brand salience. ? Working with legal team to ensure brand and trademark protection. ? Coordinated with multiple teams and departments to launch the Brand Capital website. ? Carried out naming and visual identity exercise for all investing models. ? Developed the Brand Capital | Scale Up IP. Scale Up is a mentoring platform for up and coming entrepreneurs. ? Conceptualised and executed 360 communication on print, digital and TV channels of Times Group. ? Partnered and coordinated with ET for Leaders of Tomorrow (India?s biggest platform for SME and emerging leaders). ? Working with creative, digital and event management agencies to design briefs and rolling out campaigns as per the business objectives. ? Driving the entire digital communication of Brand Capital. Working with multiple agencies and digital wings of Times group to execute digital mandate of the organisation. ? Working to develop the PR outreach campaign of Brand Capital. see less","Mumbai Area, India",https://www.linkedin.com/company/brand-capital-india,brand-capital-india,,,upGrad.com,"Faculty, Marketing Analytics",Feb-19,less than a year,,India,https://www.linkedin.com/company/ueducation,ueducation,,,Biocon,"Asst. Manager, Digital Media",May-17,Dec-17,"Responsible for building Brand Biocon?s persona on Social Media and managing various properties of Biocon, its websites and entities on the digital platform.  Ideation, execution and analysis of campaigns, website management reputation management for Social Media platforms of Biocon, Kiran Mazumdar-Shaw, Biocon Foundation, Biocon Academy and Biocon Malaysia.  Executed two online campaign with more than 10 million reach, and one on ground campaign which saw more than 5000 employee participation.  Supported the execution of BTL activations for product release, disease awareness and employee initiative campaigns.  Collaborated with media team to carry out ATL (Print, TV) activities during major company announcements, product release and for amplifying the media outreach of Kiran Mazumdar-Shaw.  Liaison with and manage the Creative, Media, and PR Agencies for Biocon Academy and Biocon Malaysia.  Identifying and creating dialogues with media influencers and pharma portals on social channels during important press releases and financial disclosures. see less","Bengaluru Area, India",https://www.linkedin.com/company/biocon,biocon,,,Infigraphic.com,Content Writer,Jul-16,less than a year,"Scouting trending news, curating innovative SEO optimized content and creating info-graphs to simplify information consumption.",,https://www.linkedin.com/search/results/all/?keywords=Infigraphic.com,,,,Zthnic,Digital Marketing Intern,May-16,Jun-16,"?Led a team of 6 to establish Facebook page of their ethnic wear brand ?Azya?; curate content, generate lead, and market the products. ?Overseeing branding consistency and creative strategy to deliver simplified marketing message and increase page engagement.",,https://www.linkedin.com/search/results/all/?keywords=Zthnic,,,,Amway India Enterprises,Marketing Intern,Apr-16,Jun-16,?Ad campaign on Nutrilite Protein Powder: Came up with the campaign ?protein for hair?. ?In-depth research on ?Re-purchase of Nutrilite protein? to deconstruct the usage pattern w.r.t loyalty points. ?Suggested marketing strategies for restructuring consumer touch points and rebranding.,"Gurgaon, India",https://www.linkedin.com/company/amway-india-enterprises-private-limited,amway-india-enterprises-private-limited,,,MICA,Master of Business Administration (M.B.A.),Brand management and Digital marketing,,2015,2017,,"International Institute of Information Technology, Bhubaneswar (IIIT-Bh)",Computer science,"Machine learning, Algorithm building, Big Data",,2009,2013,,"DAV,CSPur,BBSR","12TH,10TH","PRIMARY ,SECONDARY",,2000,2009,,"""Digital Media : 4, Brand Management : 9, Social Media Marketing : 5, Branding : 7, Graphic Design : 2, Facebook Marketing : 5, SEO : 4, Market Research : 3, Programming : 8, Algorithms : 4, PowerPoint : 4, Google Adwords : 5, Google Analytics : 3, Microsoft Excel : 6, Microsoft Office : 6, HTML : 7, JavaScript : 9, SQL : 5, Matlab : 3, C : 15, Java : 10, MySQL : 3, CSS : 2, Team Leadership : 2, Media management : 3, """,,2,,Marketing & Advertising,10,"Prayas Purusottam, Ayush Mishra",Prayas Purusottam,Ayush Mishra,Arianna Huffington; Consumer Insights Interest Group; Infosys; EY; Brand Managers; Jeff Weiner
murlidhar-roy-a77215121,Murlidhar Roy,,https://www.linkedin.com/in/murlidhar-roy-a77215121/,Murlidhar,Roy,Embedded Firmware Developer at Dozee,https://media-exp1.licdn.com/dms/image/C4E03AQGsFVJhYzsqQA/profile-displayphoto-shrink_200_200/0?e=1592438400&v=beta&t=UlAlfevEkYXkwlsYAmajZYZJg6t8He0jRmzU5NvjdfE,"Bengaluru, Karnataka, India",,Jun-27,"Experienced Firmware Engineer with a demonstrated history of working in the consumer electronics industry. Currently working in a leading Startup ""Dozee"" as a embedded Firmware Developer. Skilled in Embedded Software, ESP32, PIC, Arduino, MSP430, Intel 8085, ATMega, Renesas, Embedded C and Teamwork. Strong engineering professional with a Bachelor of Technology (B.Tech.) focused in Electronics and Telecommunication from IIIT Bhubaneswar.",,,,,,,,,,,,,,,,,Dozee,Embedded Firmware Developer,Dec-18,PRESENT,"ESP32 firmware, circuit design and sensor interfacing. BT classic, BLE, OTA updates firmware develpment in ESP32. Data logging, SD card, Wifi, HTTPS, HTTP and different protocols firmware development. Renesas RL78 firmware development. Analog and digital circuit design.",Bangalore,https://www.linkedin.com/company/dozee-health,dozee-health,,,IBM India Private Limited,Oracle Application Developer,Oct-18,Dec-18,"SQL,PLSQL,XML",Bangalore,https://www.linkedin.com/search/results/all/?keywords=IBM%20India%20Private%20Limited,,,,Volmo Pvt Ltd,Embedded Developer intern,Dec-17,Jun-18,Design and development of microcontroller based control unit for energy harvesting system. The unit should be able to sense the various parameters from input mechanical system and output battery and then accordingly control the output over IOT platforms.,"Pune Area, India",https://www.linkedin.com/search/results/all/?keywords=Volmo%20Pvt%20Ltd,,,,"Indian Institute of Technology, Guwahati",Summer Internship,May-17,Jun-17,"Title- 'Data reception and storing block for quantum cryptography application on FPGA platforms. ' The aim of this project is to create a block for the quantum cryptography application to implement different algorithms through ethernet GMII block at 100 Mbps speed. It involves reading and observing thesis to create some algorithms based on Polly Cracker, Gr”bner Bases, LWE and Regev?s scheme and Attack on Low Dimensional Noise. A Tri Mode Ethernet IP Mac Block created by using predefined functional block on Xilinx. To interface with the physical device a logiCORE GMII IP is used. For testing block design, a test bench based on observed inputs and outputs implemented which is able to create new observation for different waveforms which can be recorded by giving different inputs. see less","Guwahati Area, India",https://www.linkedin.com/company/iitg,iitg,,,Texas Instruments,Project (innovation challenge quarterfinalist),Dec-16,Mar-17,Design and development of GSM & GPS incorporated embedded system for simulated heart beat and Real Body Temperature Monitoring for patients and aged people.,,https://www.linkedin.com/company/texas-instruments,texas-instruments,,,Defence Research and Development Organisation,Project Intern,Dec-16,less than a year,"The Aim of the project was to measure radiation pulses from GM tube and to calculate gamma dose rate based upon the CPS measured. After electronic pulse processing, radiation pulse of GM tube is given to a microcontroller. The microcontroller used is PIC18F8722. My Job, as a trainee was to count these processed radiation pulses, calculate dose gamma dose rate and display the result on a 16x2 alphanumeric LCD using SPI and many more interfaces. see less","Jodhpur Area, India",https://www.linkedin.com/company/defence-research-and-development-organisation,defence-research-and-development-organisation,,,,,,,,,,,,,"International Institute of Information Technology, Bhubaneswar",Bachelor of Technology (B.Tech.),Electronics and Telecommunication,7.12 CGPA,2014,2018,,Kendriya Vidyalaya,Senior High School,Mathematics,9.4 CGPA in Matriculate and 88% in Intermediate,2010,2013,,,,,,,,,"""Internet of Things (IoT) : 0, Embedded Systems : 1, Embedded C : 0, Electronics : 3, Microcontrollers : 3, Very-Large-Scale Integration (VLSI) : 2, Python : 1, C : 5, C++ : 5, Matlab : 8, Arduino : 6, Embedded Software : 0, Assembly Language : 3, Verilog : 3, GSM : 0, VHDL : 6, Python (Programming Language) : 0, Autodesk EAGLE : 0, C (Programming Language) : 1, Teamwork : 3, ATMega : 4, Quantum cryptography : 1, Atmel AVR : 2, MPLAB : 2, espressif : 0, ESP : 0, PIC : 2, Intel 8085 : 2, porteus : 2, 8051 Microcontroller : 2, intel 8086 : 3, Intel 8051 : 2, AVR Studio 4 : 2, Service Provider Interface (SPI) : 0, I2C : 0, Universal Asynchronous Receiver/Transmitter (UART)                              Universal Asynchronous Receiver/Transmitter (UART) : 0, """,10208,2,,Consumer Electronics,56,"Abhishek Gangwar, Neel Achary",Abhishek Gangwar,Neel Achary,Arianna Huffington; Intel Corporation; Wedding Market; Richard Branson; Google; Jeff Weiner
